sample_date,sample_time,datetime,station_code,event_id,depth_m,volume_received_m_l,volume_analyzed_m_l,organisims_per_ml,percent_of_sample_counted,field_of_view_mm2,slide_chamber_area_mm2,area_counted,dimension,number_of_fields_counted,factor,comments,unit_abundance,total_cells,taxon,genus,species,synonym,diatom_soft_body,colony_filament_individual_group_code,shape,gald1,gald2,gald3,biovolume_1,biovolume_2,biovolume_3,biovolume_4,biovolume_5,biovolume_6,biovolume_7,biovolume_8,biovolume_9,biovolume_10,measurement_average,measurement_1,measurement_2,measurement_3,measurement_4,measurement_5,measurement_6,measurement_7,measurement_8,measurement_9,measurement_10,measurement_11,measurement_12,measurement_13,measurement_14,measurement_15,measurement_16,measurement_17,measurement_18,measurement_19,measurement_20,measurement_21,measurement_22,measurement_23,measurement_24,measurement_25
10/30/2013,8:50:00,10/30/2013 8:50,STTD,STTD_2013-10-30 08:50:00,0,63,3,300.2865181,0.047619048,0.069746499,314.159,0.348732495,NA,5,300.2865181,High sediment and low detritus.,1,1,cf. Cocconeis sp.,Cocconeis,sp.,NA,Diatom,i,elliptic prism,7.4,NA,NA,61.49034107,NA,NA,NA,NA,NA,NA,NA,NA,NA,NA,NA,NA,NA,NA,NA,NA,NA,NA,NA,NA,NA,NA,NA,NA,NA,NA,NA,NA,NA,NA,NA,NA,NA,NA,NA
10/30/2013,8:50:00,10/30/2013 8:50,STTD,STTD_2013-10-30 08:50:00,0,63,3,1201.146072,0.047619048,0.069746499,314.159,0.348732495,NA,5,300.2865181,High sediment and low detritus.,4,4,cf. Cyclotella sp.,Cyclotella,sp.,NA,Diatom,i,cylinder,7.4,NA,NA,159.1309583,NA,NA,NA,NA,NA,NA,NA,NA,NA,NA,NA,NA,NA,NA,NA,NA,NA,NA,NA,NA,NA,NA,NA,NA,NA,NA,NA,NA,NA,NA,NA,NA,NA,NA,NA
10/30/2013,8:50:00,10/30/2013 8:50,STTD,STTD_2013-10-30 08:50:00,0,63,3,300.2865181,0.047619048,0.069746499,314.159,0.348732495,NA,5,300.2865181,High sediment and low detritus.,1,1,Nitzschia palea,Nitzschia,palea,NA,Diatom,i,prism on parallelogram,27.8,NA,NA,190.291,NA,NA,NA,NA,NA,NA,NA,NA,NA,NA,NA,NA,NA,NA,NA,NA,NA,NA,NA,NA,NA,NA,NA,NA,NA,NA,NA,NA,NA,NA,NA,NA,NA,NA,NA
10/30/2013,8:50:00,10/30/2013 8:50,STTD,STTD_2013-10-30 08:50:00,0,63,3,300.2865181,0.047619048,0.069746499,314.159,0.348732495,NA,5,300.2865181,High sediment and low detritus.,1,1,Ankistrodesmus nannoselene,Ankistrodesmus,nannoselene,NA,Soft Body,i,cylinder + 2 cones,6.5,NA,NA,20.55581607,NA,NA,NA,NA,NA,NA,NA,NA,NA,NA,NA,NA,NA,NA,NA,NA,NA,NA,NA,NA,NA,NA,NA,NA,NA,NA,NA,NA,NA,NA,NA,NA,NA,NA,NA
10/30/2013,8:50:00,10/30/2013 8:50,STTD,STTD_2013-10-30 08:50:00,0,63,3,300.2865181,0.047619048,0.069746499,314.159,0.348732495,NA,5,300.2865181,High sediment and low detritus.,1,4,Desmodesmus opoliensis var. carinatus,Desmodesmus,opoliensis var. carinatus,NA,Soft Body,c,N/A,8.5,NA,NA,16.06661486,NA,NA,NA,NA,NA,NA,NA,NA,NA,NA,NA,NA,NA,NA,NA,NA,NA,NA,NA,NA,NA,NA,NA,NA,NA,NA,NA,NA,NA,NA,NA,NA,NA,NA,NA
10/30/2013,8:50:00,10/30/2013 8:50,STTD,STTD_2013-10-30 08:50:00,0,63,3,169962.1692,0.047619048,0.069746499,314.159,0.348732495,NA,5,300.2865181,High sediment and low detritus.,566,1153,Chroococcus microscopicus,Chroococcus,microscopicus,NA,Soft Body,c,sphere,0.8,NA,NA,0.268082347,NA,NA,NA,NA,NA,NA,NA,NA,NA,NA,NA,NA,NA,NA,NA,NA,NA,NA,NA,NA,NA,NA,NA,NA,NA,NA,NA,NA,NA,NA,NA,NA,NA,NA,NA
10/30/2013,10:24:00,10/30/2013 10:24,LIS,LIS_2013-10-30 10:24:00,0,64,1,1801.719109,0.015625,0.069746499,314.159,0.348732495,NA,5,900.8595543,Low sediment.,2,2,Navicula sp.,Navicula,sp.,NA,Diatom,i,elliptic prism,27.8,NA,NA,904.8030527,NA,NA,NA,NA,NA,NA,NA,NA,NA,NA,NA,NA,NA,NA,NA,NA,NA,NA,NA,NA,NA,NA,NA,NA,NA,NA,NA,NA,NA,NA,NA,NA,NA,NA,NA
10/30/2013,10:24:00,10/30/2013 10:24,LIS,LIS_2013-10-30 10:24:00,0,64,1,900.8595543,0.015625,0.069746499,314.159,0.348732495,NA,5,900.8595543,Low sediment.,1,1,Nitzschia sp.,Nitzschia,sp.,NA,Diatom,i,prism on parallelogram,14.8,NA,NA,52.022,NA,NA,NA,NA,NA,NA,NA,NA,NA,NA,NA,NA,NA,NA,NA,NA,NA,NA,NA,NA,NA,NA,NA,NA,NA,NA,NA,NA,NA,NA,NA,NA,NA,NA,NA
10/30/2013,10:24:00,10/30/2013 10:24,LIS,LIS_2013-10-30 10:24:00,0,64,1,900.8595543,0.015625,0.069746499,314.159,0.348732495,NA,5,900.8595543,Fragment. Low sediment.,1,1,Sellaphora sp.,Sellaphora,sp.,NA,Diatom,i,box,9.3,NA,NA,254.634,NA,NA,NA,NA,NA,NA,NA,NA,NA,NA,NA,NA,NA,NA,NA,NA,NA,NA,NA,NA,NA,NA,NA,NA,NA,NA,NA,NA,NA,NA,NA,NA,NA,NA,NA
10/30/2013,10:24:00,10/30/2013 10:24,LIS,LIS_2013-10-30 10:24:00,0,64,1,900.8595543,0.015625,0.069746499,314.159,0.348732495,NA,5,900.8595543,Low sediment.,1,1,cf. Surirella sp.,Surirella,sp.,NA,Diatom,i,elliptic prism,20.4,NA,NA,502.4533382,NA,NA,NA,NA,NA,NA,NA,NA,NA,NA,NA,NA,NA,NA,NA,NA,NA,NA,NA,NA,NA,NA,NA,NA,NA,NA,NA,NA,NA,NA,NA,NA,NA,NA,NA
10/30/2013,10:24:00,10/30/2013 10:24,LIS,LIS_2013-10-30 10:24:00,0,64,1,1801.719109,0.015625,0.069746499,314.159,0.348732495,NA,5,900.8595543,Low sediment.,2,2,cf. Chlamydomonas sp.,Chlamydomonas,sp.,NA,Soft Body,i,sphere,4.6,NA,NA,50.96496737,NA,NA,NA,NA,NA,NA,NA,NA,NA,NA,NA,NA,NA,NA,NA,NA,NA,NA,NA,NA,NA,NA,NA,NA,NA,NA,NA,NA,NA,NA,NA,NA,NA,NA,NA
10/30/2013,10:24:00,10/30/2013 10:24,LIS,LIS_2013-10-30 10:24:00,0,64,1,900.8595543,0.015625,0.069746499,314.159,0.348732495,NA,5,900.8595543,Low sediment.,1,1,Monoraphidium arcuatum,Monoraphidium,arcuatum,NA,Soft Body,i,2 cones,29.6,NA,NA,34.871649,NA,NA,NA,NA,NA,NA,NA,NA,NA,NA,NA,NA,NA,NA,NA,NA,NA,NA,NA,NA,NA,NA,NA,NA,NA,NA,NA,NA,NA,NA,NA,NA,NA,NA,NA
10/30/2013,10:24:00,10/30/2013 10:24,LIS,LIS_2013-10-30 10:24:00,0,64,1,1801.719109,0.015625,0.069746499,314.159,0.348732495,NA,5,900.8595543,Low sediment.,2,2,Monoraphidium minutum,Monoraphidium,minutum,NA,Soft Body,i,2 cones,7.4,NA,NA,8.71791225,NA,NA,NA,NA,NA,NA,NA,NA,NA,NA,NA,NA,NA,NA,NA,NA,NA,NA,NA,NA,NA,NA,NA,NA,NA,NA,NA,NA,NA,NA,NA,NA,NA,NA,NA
10/30/2013,10:24:00,10/30/2013 10:24,LIS,LIS_2013-10-30 10:24:00,0,64,1,1801.719109,0.015625,0.069746499,314.159,0.348732495,NA,5,900.8595543,Low sediment.,2,2,Plagioselmis nannoplanctica,Plagioselmis,nannoplanctica,NA,Soft Body,i,cone + half sphere,8,NA,NA,196.035216,NA,NA,NA,NA,NA,NA,NA,NA,NA,NA,NA,NA,NA,NA,NA,NA,NA,NA,NA,NA,NA,NA,NA,NA,NA,NA,NA,NA,NA,NA,NA,NA,NA,NA,NA
10/30/2013,10:24:00,10/30/2013 10:24,LIS,LIS_2013-10-30 10:24:00,0,64,1,900.8595543,0.015625,0.069746499,314.159,0.348732495,NA,5,900.8595543,Low sediment.,1,1,cf. Rhodomonas sp.,Rhodomonas,sp.,NA,Soft Body,i,cone + half sphere,13,NA,NA,862.7591538,NA,NA,NA,NA,NA,NA,NA,NA,NA,NA,NA,NA,NA,NA,NA,NA,NA,NA,NA,NA,NA,NA,NA,NA,NA,NA,NA,NA,NA,NA,NA,NA,NA,NA,NA
10/30/2013,10:24:00,10/30/2013 10:24,LIS,LIS_2013-10-30 10:24:00,0,64,1,389171.3274,0.015625,0.069746499,314.159,0.348732495,NA,5,900.8595543,Low sediment.,432,889,Chroococcus microscopicus,Chroococcus,microscopicus,NA,Soft Body,c,sphere,0.8,NA,NA,0.268082347,NA,NA,NA,NA,NA,NA,NA,NA,NA,NA,NA,NA,NA,NA,NA,NA,NA,NA,NA,NA,NA,NA,NA,NA,NA,NA,NA,NA,NA,NA,NA,NA,NA,NA,NA
10/30/2013,10:24:00,10/30/2013 10:24,LIS,LIS_2013-10-30 10:24:00,0,64,1,900.8595543,0.015625,0.069746499,314.159,0.348732495,NA,5,900.8595543,Low sediment.,1,4,Chroococcus minimus,Chroococcus,minimus,NA,Soft Body,c,sphere,1.8,NA,NA,3.05362548,NA,NA,NA,NA,NA,NA,NA,NA,NA,NA,NA,NA,NA,NA,NA,NA,NA,NA,NA,NA,NA,NA,NA,NA,NA,NA,NA,NA,NA,NA,NA,NA,NA,NA,NA
10/31/2013,9:20:00,10/31/2013 9:20,SHR,SHR_2013-10-31 09:20:00,0,60,10,64.34711102,0.166666667,0.069746499,314.159,0.488225493,NA,7,64.34711102,Girdle view. Low sediment and detritus. Many broken diatoms.,1,1,Achnanthidium minutissimum,Achnanthidium,minutissimum,NA,Diatom,i,elliptic prism,10.2,NA,NA,42.61880994,NA,NA,NA,NA,NA,NA,NA,NA,NA,NA,NA,NA,NA,NA,NA,NA,NA,NA,NA,NA,NA,NA,NA,NA,NA,NA,NA,NA,NA,NA,NA,NA,NA,NA,NA
10/31/2013,9:20:00,10/31/2013 9:20,SHR,SHR_2013-10-31 09:20:00,0,60,10,128.694222,0.166666667,0.069746499,314.159,0.488225493,NA,7,64.34711102,Low sediment and detritus. Many broken diatoms.,2,2,Achnanthidium sp.,Achnanthidium,sp.,NA,Diatom,i,elliptic prism,11.1,NA,NA,61.28692312,NA,NA,NA,NA,NA,NA,NA,NA,NA,NA,NA,NA,NA,NA,NA,NA,NA,NA,NA,NA,NA,NA,NA,NA,NA,NA,NA,NA,NA,NA,NA,NA,NA,NA,NA
10/31/2013,9:20:00,10/31/2013 9:20,SHR,SHR_2013-10-31 09:20:00,0,60,10,193.0413331,0.166666667,0.069746499,314.159,0.488225493,NA,7,64.34711102,Low sediment and detritus. Many broken diatoms.,3,3,Aulacoseira cf. alpigena,Aulacoseira,alpigena,NA,Diatom,i,cylinder,5.6,NA,NA,91.13124272,NA,NA,NA,NA,NA,NA,NA,NA,NA,NA,NA,NA,NA,NA,NA,NA,NA,NA,NA,NA,NA,NA,NA,NA,NA,NA,NA,NA,NA,NA,NA,NA,NA,NA,NA
10/31/2013,9:20:00,10/31/2013 9:20,SHR,SHR_2013-10-31 09:20:00,0,60,10,193.0413331,0.166666667,0.069746499,314.159,0.488225493,NA,7,64.34711102,Low sediment and detritus. Many broken diatoms.,3,3,Cocconeis placentula,Cocconeis,placentula,NA,Diatom,i,elliptic prism,18.5,NA,NA,499.9722675,NA,NA,NA,NA,NA,NA,NA,NA,NA,NA,NA,NA,NA,NA,NA,NA,NA,NA,NA,NA,NA,NA,NA,NA,NA,NA,NA,NA,NA,NA,NA,NA,NA,NA,NA
10/31/2013,9:20:00,10/31/2013 9:20,SHR,SHR_2013-10-31 09:20:00,0,60,10,193.0413331,0.166666667,0.069746499,314.159,0.488225493,NA,7,64.34711102,Fragment. Low sediment and detritus. Many broken diatoms.,3,3,Cocconeis placentula,Cocconeis,placentula,NA,Diatom,i,elliptic prism,11.1,NA,NA,238.6964374,NA,NA,NA,NA,NA,NA,NA,NA,NA,NA,NA,NA,NA,NA,NA,NA,NA,NA,NA,NA,NA,NA,NA,NA,NA,NA,NA,NA,NA,NA,NA,NA,NA,NA,NA
10/31/2013,9:20:00,10/31/2013 9:20,SHR,SHR_2013-10-31 09:20:00,0,60,10,450.4297771,0.166666667,0.069746499,314.159,0.488225493,NA,7,64.34711102,Low sediment and detritus. Many broken diatoms.,7,7,cf. Cyclotella sp.,Cyclotella,sp.,NA,Diatom,i,cylinder,12,NA,NA,520.247304,NA,NA,NA,NA,NA,NA,NA,NA,NA,NA,NA,NA,NA,NA,NA,NA,NA,NA,NA,NA,NA,NA,NA,NA,NA,NA,NA,NA,NA,NA,NA,NA,NA,NA,NA
10/31/2013,9:20:00,10/31/2013 9:20,SHR,SHR_2013-10-31 09:20:00,0,60,10,64.34711102,0.166666667,0.069746499,314.159,0.488225493,NA,7,64.34711102,Low sediment and detritus. Many broken diatoms.,1,1,Cymbella turgidula,Cymbella,turgidula,NA,Diatom,i,cymbelloid,28,NA,NA,328.176494,NA,NA,NA,NA,NA,NA,NA,NA,NA,NA,NA,NA,NA,NA,NA,NA,NA,NA,NA,NA,NA,NA,NA,NA,NA,NA,NA,NA,NA,NA,NA,NA,NA,NA,NA
10/31/2013,9:20:00,10/31/2013 9:20,SHR,SHR_2013-10-31 09:20:00,0,60,10,64.34711102,0.166666667,0.069746499,314.159,0.488225493,NA,7,64.34711102,Broken. Low sediment and detritus. Many broken diatoms.,1,1,Encyonema sp.,Encyonema,sp.,NA,Diatom,i,cymbelloid,27,NA,NA,372.9930658,NA,NA,NA,NA,NA,NA,NA,NA,NA,NA,NA,NA,NA,NA,NA,NA,NA,NA,NA,NA,NA,NA,NA,NA,NA,NA,NA,NA,NA,NA,NA,NA,NA,NA,NA
10/31/2013,9:20:00,10/31/2013 9:20,SHR,SHR_2013-10-31 09:20:00,0,60,10,64.34711102,0.166666667,0.069746499,314.159,0.488225493,NA,7,64.34711102,Low sediment and detritus. Many broken diatoms.,1,1,Eolimna subminuscula,Eolimna,subminuscula,NA,Diatom,i,elliptic prism,10.2,NA,NA,84.75695661,NA,NA,NA,NA,NA,NA,NA,NA,NA,NA,NA,NA,NA,NA,NA,NA,NA,NA,NA,NA,NA,NA,NA,NA,NA,NA,NA,NA,NA,NA,NA,NA,NA,NA,NA
10/31/2013,9:20:00,10/31/2013 9:20,SHR,SHR_2013-10-31 09:20:00,0,60,10,64.34711102,0.166666667,0.069746499,314.159,0.488225493,NA,7,64.34711102,Low sediment and detritus. Many broken diatoms.,1,1,Geissleria decussis,Geissleria,decussis,NA,Diatom,i,elliptic prism,22.57,NA,NA,734.5829101,NA,NA,NA,NA,NA,NA,NA,NA,NA,NA,NA,NA,NA,NA,NA,NA,NA,NA,NA,NA,NA,NA,NA,NA,NA,NA,NA,NA,NA,NA,NA,NA,NA,NA,NA
10/31/2013,9:20:00,10/31/2013 9:20,SHR,SHR_2013-10-31 09:20:00,0,60,10,64.34711102,0.166666667,0.069746499,314.159,0.488225493,NA,7,64.34711102,Low sediment and detritus. Many broken diatoms.,1,1,cf. Karayevia sp.,Karayevia,sp.,NA,Diatom,i,elliptic prism,27.8,NA,NA,904.8030527,NA,NA,NA,NA,NA,NA,NA,NA,NA,NA,NA,NA,NA,NA,NA,NA,NA,NA,NA,NA,NA,NA,NA,NA,NA,NA,NA,NA,NA,NA,NA,NA,NA,NA,NA
10/31/2013,9:20:00,10/31/2013 9:20,SHR,SHR_2013-10-31 09:20:00,0,60,10,64.34711102,0.166666667,0.069746499,314.159,0.488225493,NA,7,64.34711102,Low sediment and detritus. Many broken diatoms.,1,1,Navicula sp.,Navicula,sp.,NA,Diatom,i,elliptic prism,17.6,NA,NA,286.4124771,NA,NA,NA,NA,NA,NA,NA,NA,NA,NA,NA,NA,NA,NA,NA,NA,NA,NA,NA,NA,NA,NA,NA,NA,NA,NA,NA,NA,NA,NA,NA,NA,NA,NA,NA
10/31/2013,9:20:00,10/31/2013 9:20,SHR,SHR_2013-10-31 09:20:00,0,60,10,64.34711102,0.166666667,0.069746499,314.159,0.488225493,NA,7,64.34711102,Low sediment and detritus. Many broken diatoms.,1,1,Navicula tripunctata,Navicula,tripunctata,NA,Diatom,i,elliptic prism,42.6,NA,NA,1188.425798,NA,NA,NA,NA,NA,NA,NA,NA,NA,NA,NA,NA,NA,NA,NA,NA,NA,NA,NA,NA,NA,NA,NA,NA,NA,NA,NA,NA,NA,NA,NA,NA,NA,NA,NA
10/31/2013,9:20:00,10/31/2013 9:20,SHR,SHR_2013-10-31 09:20:00,0,60,10,64.34711102,0.166666667,0.069746499,314.159,0.488225493,NA,7,64.34711102,Low sediment and detritus. Many broken diatoms.,1,1,Nitzschia cf. agnita,Nitzschia,agnita,NA,Diatom,i,prism on parallelogram,36,NA,NA,160.38,NA,NA,NA,NA,NA,NA,NA,NA,NA,NA,NA,NA,NA,NA,NA,NA,NA,NA,NA,NA,NA,NA,NA,NA,NA,NA,NA,NA,NA,NA,NA,NA,NA,NA,NA
10/31/2013,9:20:00,10/31/2013 9:20,SHR,SHR_2013-10-31 09:20:00,0,60,10,193.0413331,0.166666667,0.069746499,314.159,0.488225493,NA,7,64.34711102,Low sediment and detritus. Many broken diatoms.,3,3,Nitzschia dissipata,Nitzschia,dissipata,NA,Diatom,i,prism on parallelogram,38.9,NA,NA,266.2705,NA,NA,NA,NA,NA,NA,NA,NA,NA,NA,NA,NA,NA,NA,NA,NA,NA,NA,NA,NA,NA,NA,NA,NA,NA,NA,NA,NA,NA,NA,NA,NA,NA,NA,NA
10/31/2013,9:20:00,10/31/2013 9:20,SHR,SHR_2013-10-31 09:20:00,0,60,10,128.694222,0.166666667,0.069746499,314.159,0.488225493,NA,7,64.34711102,Girdle view. Low sediment and detritus. Many broken diatoms.,2,2,Nitzschia cf. sigma,Nitzschia,sigma,NA,Diatom,i,prism on parallelogram,107.4,NA,NA,1684.032,NA,NA,NA,NA,NA,NA,NA,NA,NA,NA,NA,NA,NA,NA,NA,NA,NA,NA,NA,NA,NA,NA,NA,NA,NA,NA,NA,NA,NA,NA,NA,NA,NA,NA,NA
10/31/2013,9:20:00,10/31/2013 9:20,SHR,SHR_2013-10-31 09:20:00,0,60,10,64.34711102,0.166666667,0.069746499,314.159,0.488225493,NA,7,64.34711102,Small. Low sediment and detritus. Many broken diatoms.,1,1,Nitzschia sp.,Nitzschia,sp.,NA,Diatom,i,prism on parallelogram,11.1,NA,NA,75.9795,NA,NA,NA,NA,NA,NA,NA,NA,NA,NA,NA,NA,NA,NA,NA,NA,NA,NA,NA,NA,NA,NA,NA,NA,NA,NA,NA,NA,NA,NA,NA,NA,NA,NA,NA
10/31/2013,9:20:00,10/31/2013 9:20,SHR,SHR_2013-10-31 09:20:00,0,60,10,128.694222,0.166666667,0.069746499,314.159,0.488225493,NA,7,64.34711102,Low sediment and detritus. Many broken diatoms.,2,2,Rhoicosphenia abbreviata,Rhoicosphenia,abbreviata,NA,Diatom,i,gomphonemoid,9.3,NA,NA,229.0596101,NA,NA,NA,NA,NA,NA,NA,NA,NA,NA,NA,NA,NA,NA,NA,NA,NA,NA,NA,NA,NA,NA,NA,NA,NA,NA,NA,NA,NA,NA,NA,NA,NA,NA,NA
10/31/2013,9:20:00,10/31/2013 9:20,SHR,SHR_2013-10-31 09:20:00,0,60,10,514.7768881,0.166666667,0.069746499,314.159,0.488225493,NA,7,64.34711102,Fragment. Low sediment and detritus. Many broken diatoms.,8,8,cf. Ulnaria sp.,Ulnaria,sp.,NA,Diatom,i,elliptic prism,5.6,NA,NA,91.13124272,NA,NA,NA,NA,NA,NA,NA,NA,NA,NA,NA,NA,NA,NA,NA,NA,NA,NA,NA,NA,NA,NA,NA,NA,NA,NA,NA,NA,NA,NA,NA,NA,NA,NA,NA
10/31/2013,9:20:00,10/31/2013 9:20,SHR,SHR_2013-10-31 09:20:00,0,60,10,128.694222,0.166666667,0.069746499,314.159,0.488225493,NA,7,64.34711102,Low sediment and detritus. Many broken diatoms.,2,2,Chlorella sp.,Chlorella,sp.,NA,Soft Body,i,sphere,2.8,NA,NA,11.49403061,NA,NA,NA,NA,NA,NA,NA,NA,NA,NA,NA,NA,NA,NA,NA,NA,NA,NA,NA,NA,NA,NA,NA,NA,NA,NA,NA,NA,NA,NA,NA,NA,NA,NA,NA
10/31/2013,9:20:00,10/31/2013 9:20,SHR,SHR_2013-10-31 09:20:00,0,60,10,64.34711102,0.166666667,0.069746499,314.159,0.488225493,NA,7,64.34711102,Low sediment and detritus. Many broken diatoms.,1,1,Monoraphidium arcuatum,Monoraphidium,arcuatum,NA,Soft Body,i,2 cones,44.4,NA,NA,75.32276184,NA,NA,NA,NA,NA,NA,NA,NA,NA,NA,NA,NA,NA,NA,NA,NA,NA,NA,NA,NA,NA,NA,NA,NA,NA,NA,NA,NA,NA,NA,NA,NA,NA,NA,NA
10/31/2013,9:20:00,10/31/2013 9:20,SHR,SHR_2013-10-31 09:20:00,0,60,10,64.34711102,0.166666667,0.069746499,314.159,0.488225493,NA,7,64.34711102,Low sediment and detritus. Many broken diatoms.,1,1,Monoraphidium contortum,Monoraphidium,contortum,NA,Soft Body,i,2 cones,18.5,NA,NA,7.846121025,NA,NA,NA,NA,NA,NA,NA,NA,NA,NA,NA,NA,NA,NA,NA,NA,NA,NA,NA,NA,NA,NA,NA,NA,NA,NA,NA,NA,NA,NA,NA,NA,NA,NA,NA
10/31/2013,9:20:00,10/31/2013 9:20,SHR,SHR_2013-10-31 09:20:00,0,60,10,64.34711102,0.166666667,0.069746499,314.159,0.488225493,NA,7,64.34711102,Low sediment and detritus. Many broken diatoms.,1,1,Cryptomonas erosa,Cryptomonas,erosa,NA,Soft Body,i,prolate spheroid,13,NA,NA,468.9189594,NA,NA,NA,NA,NA,NA,NA,NA,NA,NA,NA,NA,NA,NA,NA,NA,NA,NA,NA,NA,NA,NA,NA,NA,NA,NA,NA,NA,NA,NA,NA,NA,NA,NA,NA
10/31/2013,9:20:00,10/31/2013 9:20,SHR,SHR_2013-10-31 09:20:00,0,60,10,128.694222,0.166666667,0.069746499,314.159,0.488225493,NA,7,64.34711102,Low sediment and detritus. Many broken diatoms.,2,2,Cryptomonas ovata,Cryptomonas,ovata,NA,Soft Body,i,prolate spheroid,20.4,NA,NA,1316.056033,NA,NA,NA,NA,NA,NA,NA,NA,NA,NA,NA,NA,NA,NA,NA,NA,NA,NA,NA,NA,NA,NA,NA,NA,NA,NA,NA,NA,NA,NA,NA,NA,NA,NA,NA
10/31/2013,9:20:00,10/31/2013 9:20,SHR,SHR_2013-10-31 09:20:00,0,60,10,514.7768881,0.166666667,0.069746499,314.159,0.488225493,NA,7,64.34711102,Low sediment and detritus. Many broken diatoms.,8,8,Plagioselmis nannoplanctica,Plagioselmis,nannoplanctica,NA,Soft Body,i,cone + half sphere,8.5,NA,NA,264.8098571,NA,NA,NA,NA,NA,NA,NA,NA,NA,NA,NA,NA,NA,NA,NA,NA,NA,NA,NA,NA,NA,NA,NA,NA,NA,NA,NA,NA,NA,NA,NA,NA,NA,NA,NA
10/31/2013,9:20:00,10/31/2013 9:20,SHR,SHR_2013-10-31 09:20:00,0,60,10,23937.1253,0.166666667,0.069746499,314.159,0.488225493,NA,7,64.34711102,Low sediment and detritus. Many broken diatoms.,372,913,Chroococcus microscopicus,Chroococcus,microscopicus,NA,Soft Body,c,sphere,0.8,NA,NA,0.268082347,NA,NA,NA,NA,NA,NA,NA,NA,NA,NA,NA,NA,NA,NA,NA,NA,NA,NA,NA,NA,NA,NA,NA,NA,NA,NA,NA,NA,NA,NA,NA,NA,NA,NA,NA
10/31/2013,9:20:00,10/31/2013 9:20,SHR,SHR_2013-10-31 09:20:00,0,60,10,193.0413331,0.166666667,0.069746499,314.159,0.488225493,NA,7,64.34711102,Low sediment and detritus. Many broken diatoms.,3,8,Eucapsis cf. starmachii,Eucapsis,starmachii,NA,Soft Body,c,prolate spheroid,1.9,NA,NA,3.591360968,NA,NA,NA,NA,NA,NA,NA,NA,NA,NA,NA,NA,NA,NA,NA,NA,NA,NA,NA,NA,NA,NA,NA,NA,NA,NA,NA,NA,NA,NA,NA,NA,NA,NA,NA
11/5/2013,9:40:00,11/5/2013 9:40,LIS,LIS_2013-11-05 09:40:00,0,63,3,300.2865181,0.047619048,0.069746499,314.159,0.348732495,NA,5,300.2865181,Fragment. Moderate sediment.,1,1,Aulacoseira sp.,Aulacoseira,sp.,NA,Diatom,i,cylinder,9.3,NA,NA,399.977814,NA,NA,NA,NA,NA,NA,NA,NA,NA,NA,NA,NA,NA,NA,NA,NA,NA,NA,NA,NA,NA,NA,NA,NA,NA,NA,NA,NA,NA,NA,NA,NA,NA,NA,NA
11/5/2013,9:40:00,11/5/2013 9:40,LIS,LIS_2013-11-05 09:40:00,0,63,3,900.8595543,0.047619048,0.069746499,314.159,0.348732495,NA,5,300.2865181,Moderate sediment.,3,3,cf. Cyclotella sp.,Cyclotella,sp.,NA,Diatom,i,cylinder,5.6,NA,NA,91.13124272,NA,NA,NA,NA,NA,NA,NA,NA,NA,NA,NA,NA,NA,NA,NA,NA,NA,NA,NA,NA,NA,NA,NA,NA,NA,NA,NA,NA,NA,NA,NA,NA,NA,NA,NA
11/5/2013,9:40:00,11/5/2013 9:40,LIS,LIS_2013-11-05 09:40:00,0,63,3,300.2865181,0.047619048,0.069746499,314.159,0.348732495,NA,5,300.2865181,Moderate sediment.,1,1,Nitzschia palea,Nitzschia,palea,NA,Diatom,i,prism on parallelogram,24.1,NA,NA,205.091,NA,NA,NA,NA,NA,NA,NA,NA,NA,NA,NA,NA,NA,NA,NA,NA,NA,NA,NA,NA,NA,NA,NA,NA,NA,NA,NA,NA,NA,NA,NA,NA,NA,NA,NA
11/5/2013,9:40:00,11/5/2013 9:40,LIS,LIS_2013-11-05 09:40:00,0,63,3,900.8595543,0.047619048,0.069746499,314.159,0.348732495,NA,5,300.2865181,Moderate sediment.,3,3,Ankistrodesmus nannoselene,Ankistrodesmus,nannoselene,NA,Soft Body,i,cylinder + 2 cones,5.6,NA,NA,18.00405959,NA,NA,NA,NA,NA,NA,NA,NA,NA,NA,NA,NA,NA,NA,NA,NA,NA,NA,NA,NA,NA,NA,NA,NA,NA,NA,NA,NA,NA,NA,NA,NA,NA,NA,NA
11/5/2013,9:40:00,11/5/2013 9:40,LIS,LIS_2013-11-05 09:40:00,0,63,3,300.2865181,0.047619048,0.069746499,314.159,0.348732495,NA,5,300.2865181,Moderate sediment.,1,1,Chlamydomonas sp.,Chlamydomonas,sp.,NA,Soft Body,i,sphere,3.7,NA,NA,26.52182638,NA,NA,NA,NA,NA,NA,NA,NA,NA,NA,NA,NA,NA,NA,NA,NA,NA,NA,NA,NA,NA,NA,NA,NA,NA,NA,NA,NA,NA,NA,NA,NA,NA,NA,NA
11/5/2013,9:40:00,11/5/2013 9:40,LIS,LIS_2013-11-05 09:40:00,0,63,3,600.5730362,0.047619048,0.069746499,314.159,0.348732495,NA,5,300.2865181,Moderate sediment.,2,2,Plagioselmis nannoplanctica,Plagioselmis,nannoplanctica,NA,Soft Body,i,cone + half sphere,7.4,NA,NA,159.1309583,NA,NA,NA,NA,NA,NA,NA,NA,NA,NA,NA,NA,NA,NA,NA,NA,NA,NA,NA,NA,NA,NA,NA,NA,NA,NA,NA,NA,NA,NA,NA,NA,NA,NA,NA
11/5/2013,9:40:00,11/5/2013 9:40,LIS,LIS_2013-11-05 09:40:00,0,63,3,132426.3545,0.047619048,0.069746499,314.159,0.348732495,NA,5,300.2865181,Moderate sediment.,441,902,Chroococcus microscopicus,Chroococcus,microscopicus,NA,Soft Body,c,sphere,0.8,NA,NA,0.268082347,NA,NA,NA,NA,NA,NA,NA,NA,NA,NA,NA,NA,NA,NA,NA,NA,NA,NA,NA,NA,NA,NA,NA,NA,NA,NA,NA,NA,NA,NA,NA,NA,NA,NA,NA
11/13/2013,9:44:00,11/13/2013 9:44,SHR,SHR_2013-11-13 09:44:00,0,66,10,225.2148886,0.151515152,0.069746499,314.159,0.557971992,NA,8,56.30372214,Low sediment and moderate detritus. Many broken diatoms.,4,4,Achnanthidium minutissimum,Achnanthidium,minutissimum,NA,Diatom,i,elliptic prism,24.1,NA,NA,259.1254118,NA,NA,NA,NA,NA,NA,NA,NA,NA,NA,NA,NA,NA,NA,NA,NA,NA,NA,NA,NA,NA,NA,NA,NA,NA,NA,NA,NA,NA,NA,NA,NA,NA,NA,NA
11/13/2013,9:44:00,11/13/2013 9:44,SHR,SHR_2013-11-13 09:44:00,0,66,10,56.30372214,0.151515152,0.069746499,314.159,0.557971992,NA,8,56.30372214,Low sediment and moderate detritus. Many broken diatoms.,1,1,Aulacoseira sp.,Aulacoseira,sp.,NA,Diatom,i,cylinder,14.8,NA,NA,364.5249709,NA,NA,NA,NA,NA,NA,NA,NA,NA,NA,NA,NA,NA,NA,NA,NA,NA,NA,NA,NA,NA,NA,NA,NA,NA,NA,NA,NA,NA,NA,NA,NA,NA,NA,NA
11/13/2013,9:44:00,11/13/2013 9:44,SHR,SHR_2013-11-13 09:44:00,0,66,10,56.30372214,0.151515152,0.069746499,314.159,0.557971992,NA,8,56.30372214,Low sediment and moderate detritus. Many broken diatoms.,1,1,Cocconeis placentula,Cocconeis,placentula,NA,Diatom,i,elliptic prism,18.5,NA,NA,405.3829196,NA,NA,NA,NA,NA,NA,NA,NA,NA,NA,NA,NA,NA,NA,NA,NA,NA,NA,NA,NA,NA,NA,NA,NA,NA,NA,NA,NA,NA,NA,NA,NA,NA,NA,NA
11/13/2013,9:44:00,11/13/2013 9:44,SHR,SHR_2013-11-13 09:44:00,0,66,10,112.6074443,0.151515152,0.069746499,314.159,0.557971992,NA,8,56.30372214,Low sediment and moderate detritus. Many broken diatoms.,2,2,cf. Cyclotella sp.,Cyclotella,sp.,NA,Diatom,i,cylinder,9.3,NA,NA,251.3374102,NA,NA,NA,NA,NA,NA,NA,NA,NA,NA,NA,NA,NA,NA,NA,NA,NA,NA,NA,NA,NA,NA,NA,NA,NA,NA,NA,NA,NA,NA,NA,NA,NA,NA,NA
11/13/2013,9:44:00,11/13/2013 9:44,SHR,SHR_2013-11-13 09:44:00,0,66,10,56.30372214,0.151515152,0.069746499,314.159,0.557971992,NA,8,56.30372214,Low sediment and moderate detritus. Many broken diatoms.,1,1,Cymbella affinis,Cymbella,affinis,NA,Diatom,i,cymbelloid,31.5,NA,NA,546.9165765,NA,NA,NA,NA,NA,NA,NA,NA,NA,NA,NA,NA,NA,NA,NA,NA,NA,NA,NA,NA,NA,NA,NA,NA,NA,NA,NA,NA,NA,NA,NA,NA,NA,NA,NA
11/13/2013,9:44:00,11/13/2013 9:44,SHR,SHR_2013-11-13 09:44:00,0,66,10,56.30372214,0.151515152,0.069746499,314.159,0.557971992,NA,8,56.30372214,Fragment. Low sediment and moderate detritus. Many broken diatoms.,1,1,Navicula sp.,Navicula,sp.,NA,Diatom,i,elliptic prism,11.1,NA,NA,180.6351418,NA,NA,NA,NA,NA,NA,NA,NA,NA,NA,NA,NA,NA,NA,NA,NA,NA,NA,NA,NA,NA,NA,NA,NA,NA,NA,NA,NA,NA,NA,NA,NA,NA,NA,NA
11/13/2013,9:44:00,11/13/2013 9:44,SHR,SHR_2013-11-13 09:44:00,0,66,10,112.6074443,0.151515152,0.069746499,314.159,0.557971992,NA,8,56.30372214,Low sediment and moderate detritus. Many broken diatoms.,2,2,Nitzschia dissipata,Nitzschia,dissipata,NA,Diatom,i,prism on parallelogram,29.6,NA,NA,251.896,NA,NA,NA,NA,NA,NA,NA,NA,NA,NA,NA,NA,NA,NA,NA,NA,NA,NA,NA,NA,NA,NA,NA,NA,NA,NA,NA,NA,NA,NA,NA,NA,NA,NA,NA
11/13/2013,9:44:00,11/13/2013 9:44,SHR,SHR_2013-11-13 09:44:00,0,66,10,56.30372214,0.151515152,0.069746499,314.159,0.557971992,NA,8,56.30372214,Fragment. Low sediment and moderate detritus. Many broken diatoms.,1,1,Nitzschia sp.,Nitzschia,sp.,NA,Diatom,i,prism on parallelogram,13,NA,NA,88.985,NA,NA,NA,NA,NA,NA,NA,NA,NA,NA,NA,NA,NA,NA,NA,NA,NA,NA,NA,NA,NA,NA,NA,NA,NA,NA,NA,NA,NA,NA,NA,NA,NA,NA,NA
11/13/2013,9:44:00,11/13/2013 9:44,SHR,SHR_2013-11-13 09:44:00,0,66,10,1238.681887,0.151515152,0.069746499,314.159,0.557971992,NA,8,56.30372214,Small. Girdle view. Low sediment and moderate detritus. Many broken diatoms.,22,22,cf. Skeletonema sp.,Skeletonema,sp.,NA,Diatom,i,cylinder + 2 half spheres,3.7,NA,NA,39.78273957,NA,NA,NA,NA,NA,NA,NA,NA,NA,NA,NA,NA,NA,NA,NA,NA,NA,NA,NA,NA,NA,NA,NA,NA,NA,NA,NA,NA,NA,NA,NA,NA,NA,NA,NA
11/13/2013,9:44:00,11/13/2013 9:44,SHR,SHR_2013-11-13 09:44:00,0,66,10,56.30372214,0.151515152,0.069746499,314.159,0.557971992,NA,8,56.30372214,Girdle view. Low sediment and moderate detritus. Many broken diatoms.,1,1,cf. Ulnaria sp.,Ulnaria,sp.,NA,Diatom,i,elliptic prism,229.6,NA,NA,9874.721086,NA,NA,NA,NA,NA,NA,NA,NA,NA,NA,NA,NA,NA,NA,NA,NA,NA,NA,NA,NA,NA,NA,NA,NA,NA,NA,NA,NA,NA,NA,NA,NA,NA,NA,NA
11/13/2013,9:44:00,11/13/2013 9:44,SHR,SHR_2013-11-13 09:44:00,0,66,10,563.0372214,0.151515152,0.069746499,314.159,0.557971992,NA,8,56.30372214,Fragment. Low sediment and moderate detritus. Many broken diatoms.,10,10,cf. Ulnaria sp.,Ulnaria,sp.,NA,Diatom,i,elliptic prism,18.5,NA,NA,446.2118087,NA,NA,NA,NA,NA,NA,NA,NA,NA,NA,NA,NA,NA,NA,NA,NA,NA,NA,NA,NA,NA,NA,NA,NA,NA,NA,NA,NA,NA,NA,NA,NA,NA,NA,NA
11/13/2013,9:44:00,11/13/2013 9:44,SHR,SHR_2013-11-13 09:44:00,0,66,10,1858.022831,0.151515152,0.069746499,314.159,0.557971992,NA,8,56.30372214,Low sediment and moderate detritus. Many broken diatoms.,33,33,Chlorella sp.,Chlorella,sp.,NA,Soft Body,i,sphere,3.7,NA,NA,26.52182638,NA,NA,NA,NA,NA,NA,NA,NA,NA,NA,NA,NA,NA,NA,NA,NA,NA,NA,NA,NA,NA,NA,NA,NA,NA,NA,NA,NA,NA,NA,NA,NA,NA,NA,NA
11/13/2013,9:44:00,11/13/2013 9:44,SHR,SHR_2013-11-13 09:44:00,0,66,10,112.6074443,0.151515152,0.069746499,314.159,0.557971992,NA,8,56.30372214,Low sediment and moderate detritus. Many broken diatoms.,2,2,Plagioselmis nannoplanctica,Plagioselmis,nannoplanctica,NA,Soft Body,i,cone + half sphere,9.3,NA,NA,335.1165469,NA,NA,NA,NA,NA,NA,NA,NA,NA,NA,NA,NA,NA,NA,NA,NA,NA,NA,NA,NA,NA,NA,NA,NA,NA,NA,NA,NA,NA,NA,NA,NA,NA,NA,NA
11/13/2013,9:44:00,11/13/2013 9:44,SHR,SHR_2013-11-13 09:44:00,0,66,10,18467.62086,0.151515152,0.069746499,314.159,0.557971992,NA,8,56.30372214,Low sediment and moderate detritus. Many broken diatoms.,328,732,Chroococcus microscopicus,Chroococcus,microscopicus,NA,Soft Body,c,sphere,0.8,NA,NA,0.268082347,NA,NA,NA,NA,NA,NA,NA,NA,NA,NA,NA,NA,NA,NA,NA,NA,NA,NA,NA,NA,NA,NA,NA,NA,NA,NA,NA,NA,NA,NA,NA,NA,NA,NA,NA
11/13/2013,9:44:00,11/13/2013 9:44,SHR,SHR_2013-11-13 09:44:00,0,66,10,56.30372214,0.151515152,0.069746499,314.159,0.557971992,NA,8,56.30372214,Low sediment and moderate detritus. Many broken diatoms.,1,18,cf. Planktolyngbya sp.,Planktolyngbya,sp.,NA,Soft Body,f,cylinder,0.9,NA,NA,0.572554778,NA,NA,NA,NA,NA,NA,NA,NA,NA,NA,NA,NA,NA,NA,NA,NA,NA,NA,NA,NA,NA,NA,NA,NA,NA,NA,NA,NA,NA,NA,NA,NA,NA,NA,NA
11/13/2013,9:44:00,11/13/2013 9:44,SHR,SHR_2013-11-13 09:44:00,0,66,10,394.126055,0.151515152,0.069746499,314.159,0.557971992,NA,8,56.30372214,Girdle view. Obscured by detritus. Low sediment and moderate detritus. Many broken diatoms.,7,7,Fragilaria cf. brevistriata,Fragilaria,brevistriata,NA,Diatom,c,elliptic prism,14.8,NA,NA,240.8468558,NA,NA,NA,NA,NA,NA,NA,NA,NA,NA,NA,NA,NA,NA,NA,NA,NA,NA,NA,NA,NA,NA,NA,NA,NA,NA,NA,NA,NA,NA,NA,NA,NA,NA,NA
11/19/2013,10:50:00,11/19/2013 10:50,LIS,LIS_2013-11-19 10:50:00,0,63,1,900.8595543,0.015873016,0.069746499,314.159,0.348732495,NA,5,900.8595543,High sediment and low detritus.,1,1,cf. Cyclotella sp.,Cyclotella,sp.,NA,Diatom,i,cylinder,6.5,NA,NA,122.7772642,NA,NA,NA,NA,NA,NA,NA,NA,NA,NA,NA,NA,NA,NA,NA,NA,NA,NA,NA,NA,NA,NA,NA,NA,NA,NA,NA,NA,NA,NA,NA,NA,NA,NA,NA
11/19/2013,10:50:00,11/19/2013 10:50,LIS,LIS_2013-11-19 10:50:00,0,63,1,900.8595543,0.015873016,0.069746499,314.159,0.348732495,NA,5,900.8595543,High sediment and low detritus.,1,1,Navicula sp.,Navicula,sp.,NA,Diatom,i,elliptic prism,20.4,NA,NA,331.9780985,NA,NA,NA,NA,NA,NA,NA,NA,NA,NA,NA,NA,NA,NA,NA,NA,NA,NA,NA,NA,NA,NA,NA,NA,NA,NA,NA,NA,NA,NA,NA,NA,NA,NA,NA
11/19/2013,10:50:00,11/19/2013 10:50,LIS,LIS_2013-11-19 10:50:00,0,63,1,1801.719109,0.015873016,0.069746499,314.159,0.348732495,NA,5,900.8595543,High sediment and low detritus.,2,2,cf. Planothidium sp.,Planothidium,sp.,NA,Diatom,i,elliptic prism,9.3,NA,NA,51.34850315,NA,NA,NA,NA,NA,NA,NA,NA,NA,NA,NA,NA,NA,NA,NA,NA,NA,NA,NA,NA,NA,NA,NA,NA,NA,NA,NA,NA,NA,NA,NA,NA,NA,NA,NA
11/19/2013,10:50:00,11/19/2013 10:50,LIS,LIS_2013-11-19 10:50:00,0,63,1,900.8595543,0.015873016,0.069746499,314.159,0.348732495,NA,5,900.8595543,High sediment and low detritus.,1,1,Monoraphidium minutum,Monoraphidium,minutum,NA,Soft Body,i,2 cones,9.3,NA,NA,17.57876685,NA,NA,NA,NA,NA,NA,NA,NA,NA,NA,NA,NA,NA,NA,NA,NA,NA,NA,NA,NA,NA,NA,NA,NA,NA,NA,NA,NA,NA,NA,NA,NA,NA,NA,NA
11/19/2013,10:50:00,11/19/2013 10:50,LIS,LIS_2013-11-19 10:50:00,0,63,1,900.8595543,0.015873016,0.069746499,314.159,0.348732495,NA,5,900.8595543,High sediment and low detritus.,1,1,Pyramimonas sp.,Pyramimonas,sp.,NA,Soft Body,i,cone,11.1,NA,NA,251.3374102,NA,NA,NA,NA,NA,NA,NA,NA,NA,NA,NA,NA,NA,NA,NA,NA,NA,NA,NA,NA,NA,NA,NA,NA,NA,NA,NA,NA,NA,NA,NA,NA,NA,NA,NA
11/19/2013,10:50:00,11/19/2013 10:50,LIS,LIS_2013-11-19 10:50:00,0,63,1,435115.1647,0.015873016,0.069746499,314.159,0.348732495,NA,5,900.8595543,High sediment and low detritus.,483,964,Chroococcus microscopicus,Chroococcus,microscopicus,NA,Soft Body,c,sphere,0.8,NA,NA,0.268082347,NA,NA,NA,NA,NA,NA,NA,NA,NA,NA,NA,NA,NA,NA,NA,NA,NA,NA,NA,NA,NA,NA,NA,NA,NA,NA,NA,NA,NA,NA,NA,NA,NA,NA,NA
12/3/2013,14:05:00,12/3/2013 14:05,LIS,LIS_2013-12-03 14:05:00,0,65,5,180.1719109,0.076923077,0.069746499,314.159,0.348732495,NA,5,180.1719109,Moderate sediment.,1,1,Nitzschia sp.,Nitzschia,sp.,NA,Diatom,i,prism on parallelogram,22.2,NA,NA,59.052,NA,NA,NA,NA,NA,NA,NA,NA,NA,NA,NA,NA,NA,NA,NA,NA,NA,NA,NA,NA,NA,NA,NA,NA,NA,NA,NA,NA,NA,NA,NA,NA,NA,NA,NA
12/3/2013,14:05:00,12/3/2013 14:05,LIS,LIS_2013-12-03 14:05:00,0,65,5,180.1719109,0.076923077,0.069746499,314.159,0.348732495,NA,5,180.1719109,Moderate sediment.,1,1,Ankistrodesmus nannoselene,Ankistrodesmus,nannoselene,NA,Soft Body,i,cylinder + 2 cones,5.6,NA,NA,2.915788219,NA,NA,NA,NA,NA,NA,NA,NA,NA,NA,NA,NA,NA,NA,NA,NA,NA,NA,NA,NA,NA,NA,NA,NA,NA,NA,NA,NA,NA,NA,NA,NA,NA,NA,NA
12/3/2013,14:05:00,12/3/2013 14:05,LIS,LIS_2013-12-03 14:05:00,0,65,5,180.1719109,0.076923077,0.069746499,314.159,0.348732495,NA,5,180.1719109,Moderate sediment.,1,1,Chlamydomonas sp.,Chlamydomonas,sp.,NA,Soft Body,i,sphere,4.6,NA,NA,50.96496737,NA,NA,NA,NA,NA,NA,NA,NA,NA,NA,NA,NA,NA,NA,NA,NA,NA,NA,NA,NA,NA,NA,NA,NA,NA,NA,NA,NA,NA,NA,NA,NA,NA,NA,NA
12/3/2013,14:05:00,12/3/2013 14:05,LIS,LIS_2013-12-03 14:05:00,0,65,5,180.1719109,0.076923077,0.069746499,314.159,0.348732495,NA,5,180.1719109,Moderate sediment.,1,1,Monoraphidium contortum,Monoraphidium,contortum,NA,Soft Body,i,2 cones,27.8,NA,NA,17.61280074,NA,NA,NA,NA,NA,NA,NA,NA,NA,NA,NA,NA,NA,NA,NA,NA,NA,NA,NA,NA,NA,NA,NA,NA,NA,NA,NA,NA,NA,NA,NA,NA,NA,NA,NA
12/3/2013,14:05:00,12/3/2013 14:05,LIS,LIS_2013-12-03 14:05:00,0,65,5,180.1719109,0.076923077,0.069746499,314.159,0.348732495,NA,5,180.1719109,Moderate sediment.,1,1,cf. Monoraphidium komarkovae,Monoraphidium,komarkovae,NA,Soft Body,i,2 cones,101.9,NA,NA,307.3229002,NA,NA,NA,NA,NA,NA,NA,NA,NA,NA,NA,NA,NA,NA,NA,NA,NA,NA,NA,NA,NA,NA,NA,NA,NA,NA,NA,NA,NA,NA,NA,NA,NA,NA,NA
12/3/2013,14:05:00,12/3/2013 14:05,LIS,LIS_2013-12-03 14:05:00,0,65,5,360.3438217,0.076923077,0.069746499,314.159,0.348732495,NA,5,180.1719109,Moderate sediment.,2,2,Cryptomonas ovata,Cryptomonas,ovata,NA,Soft Body,i,prolate spheroid,24.1,NA,NA,1817.095656,NA,NA,NA,NA,NA,NA,NA,NA,NA,NA,NA,NA,NA,NA,NA,NA,NA,NA,NA,NA,NA,NA,NA,NA,NA,NA,NA,NA,NA,NA,NA,NA,NA,NA,NA
12/3/2013,14:05:00,12/3/2013 14:05,LIS,LIS_2013-12-03 14:05:00,0,65,5,80356.67224,0.076923077,0.069746499,314.159,0.348732495,NA,5,180.1719109,Moderate sediment.,446,934,Chroococcus microscopicus,Chroococcus,microscopicus,NA,Soft Body,c,sphere,0.8,NA,NA,0.268082347,NA,NA,NA,NA,NA,NA,NA,NA,NA,NA,NA,NA,NA,NA,NA,NA,NA,NA,NA,NA,NA,NA,NA,NA,NA,NA,NA,NA,NA,NA,NA,NA,NA,NA,NA
12/3/2013,14:05:00,12/3/2013 14:05,LIS,LIS_2013-12-03 14:05:00,0,65,5,180.1719109,0.076923077,0.069746499,314.159,0.348732495,NA,5,180.1719109,Moderate sediment.,1,7,cf. Glaucospira sp.,Glaucospira,sp.,NA,Soft Body,f,cylinder,0.9,NA,NA,0.572554778,NA,NA,NA,NA,NA,NA,NA,NA,NA,NA,NA,NA,NA,NA,NA,NA,NA,NA,NA,NA,NA,NA,NA,NA,NA,NA,NA,NA,NA,NA,NA,NA,NA,NA,NA
12/17/2013,9:20:00,12/17/2013 9:20,SHR,SHR_2013-12-17 09:20:00,0,65,10,180.1719109,0.153846154,0.069746499,314.159,0.348732495,NA,5,90.08595543,Moderate sediment.,2,2,Cocconeis placentula,Cocconeis,placentula,NA,Diatom,i,elliptic prism,18.5,NA,NA,397.8273957,NA,NA,NA,NA,NA,NA,NA,NA,NA,NA,NA,NA,NA,NA,NA,NA,NA,NA,NA,NA,NA,NA,NA,NA,NA,NA,NA,NA,NA,NA,NA,NA,NA,NA,NA
12/17/2013,9:20:00,12/17/2013 9:20,SHR,SHR_2013-12-17 09:20:00,0,65,10,180.1719109,0.153846154,0.069746499,314.159,0.348732495,NA,5,90.08595543,Moderate sediment.,2,2,cf. Cyclotella sp.,Cyclotella,sp.,NA,Diatom,i,cylinder,8.3,NA,NA,200.192325,NA,NA,NA,NA,NA,NA,NA,NA,NA,NA,NA,NA,NA,NA,NA,NA,NA,NA,NA,NA,NA,NA,NA,NA,NA,NA,NA,NA,NA,NA,NA,NA,NA,NA,NA
12/17/2013,9:20:00,12/17/2013 9:20,SHR,SHR_2013-12-17 09:20:00,0,65,10,90.08595543,0.153846154,0.069746499,314.159,0.348732495,NA,5,90.08595543,Fragment. Moderate sediment.,1,1,Encyonema sp.,Encyonema,sp.,NA,Diatom,i,cymbelloid,24.1,NA,NA,499.4516185,NA,NA,NA,NA,NA,NA,NA,NA,NA,NA,NA,NA,NA,NA,NA,NA,NA,NA,NA,NA,NA,NA,NA,NA,NA,NA,NA,NA,NA,NA,NA,NA,NA,NA,NA
12/17/2013,9:20:00,12/17/2013 9:20,SHR,SHR_2013-12-17 09:20:00,0,65,10,90.08595543,0.153846154,0.069746499,314.159,0.348732495,NA,5,90.08595543,Moderate sediment.,1,1,Nitzschia dissipata,Nitzschia,dissipata,NA,Diatom,i,prism on parallelogram,27.8,NA,NA,236.578,NA,NA,NA,NA,NA,NA,NA,NA,NA,NA,NA,NA,NA,NA,NA,NA,NA,NA,NA,NA,NA,NA,NA,NA,NA,NA,NA,NA,NA,NA,NA,NA,NA,NA,NA
12/17/2013,9:20:00,12/17/2013 9:20,SHR,SHR_2013-12-17 09:20:00,0,65,10,90.08595543,0.153846154,0.069746499,314.159,0.348732495,NA,5,90.08595543,Girdle view. Moderate sediment.,1,1,Nitzschia sp.,Nitzschia,sp.,NA,Diatom,i,prism on parallelogram,15.7,NA,NA,119.0845,NA,NA,NA,NA,NA,NA,NA,NA,NA,NA,NA,NA,NA,NA,NA,NA,NA,NA,NA,NA,NA,NA,NA,NA,NA,NA,NA,NA,NA,NA,NA,NA,NA,NA,NA
12/17/2013,9:20:00,12/17/2013 9:20,SHR,SHR_2013-12-17 09:20:00,0,65,10,90.08595543,0.153846154,0.069746499,314.159,0.348732495,NA,5,90.08595543,Girdle view. Moderate sediment.,1,1,Planothidium sp.,Planothidium,sp.,NA,Diatom,i,elliptic prism,12,NA,NA,226.6657185,NA,NA,NA,NA,NA,NA,NA,NA,NA,NA,NA,NA,NA,NA,NA,NA,NA,NA,NA,NA,NA,NA,NA,NA,NA,NA,NA,NA,NA,NA,NA,NA,NA,NA,NA
12/17/2013,9:20:00,12/17/2013 9:20,SHR,SHR_2013-12-17 09:20:00,0,65,10,90.08595543,0.153846154,0.069746499,314.159,0.348732495,NA,5,90.08595543,Moderate sediment.,1,1,Reimeria sinuata,Reimeria,sinuata,NA,Diatom,i,elliptic prism,13.9,NA,NA,185.8077698,NA,NA,NA,NA,NA,NA,NA,NA,NA,NA,NA,NA,NA,NA,NA,NA,NA,NA,NA,NA,NA,NA,NA,NA,NA,NA,NA,NA,NA,NA,NA,NA,NA,NA,NA
12/17/2013,9:20:00,12/17/2013 9:20,SHR,SHR_2013-12-17 09:20:00,0,65,10,90.08595543,0.153846154,0.069746499,314.159,0.348732495,NA,5,90.08595543,Fragment. Moderate sediment.,1,1,cf. Ulnaria sp.,Ulnaria,sp.,NA,Diatom,i,elliptic prism,11.1,NA,NA,148.3788665,NA,NA,NA,NA,NA,NA,NA,NA,NA,NA,NA,NA,NA,NA,NA,NA,NA,NA,NA,NA,NA,NA,NA,NA,NA,NA,NA,NA,NA,NA,NA,NA,NA,NA,NA
12/17/2013,9:20:00,12/17/2013 9:20,SHR,SHR_2013-12-17 09:20:00,0,65,10,90.08595543,0.153846154,0.069746499,314.159,0.348732495,NA,5,90.08595543,Girdle view. Moderate sediment.,1,1,cf. Ulnaria sp.,Ulnaria,sp.,NA,Diatom,i,elliptic prism,216.7,NA,NA,16372.8204,NA,NA,NA,NA,NA,NA,NA,NA,NA,NA,NA,NA,NA,NA,NA,NA,NA,NA,NA,NA,NA,NA,NA,NA,NA,NA,NA,NA,NA,NA,NA,NA,NA,NA,NA
12/17/2013,9:20:00,12/17/2013 9:20,SHR,SHR_2013-12-17 09:20:00,0,65,10,270.2578663,0.153846154,0.069746499,314.159,0.348732495,NA,5,90.08595543,Moderate sediment.,3,3,Chlorella sp.,Chlorella,sp.,NA,Soft Body,i,sphere,5.6,NA,NA,91.95224491,NA,NA,NA,NA,NA,NA,NA,NA,NA,NA,NA,NA,NA,NA,NA,NA,NA,NA,NA,NA,NA,NA,NA,NA,NA,NA,NA,NA,NA,NA,NA,NA,NA,NA,NA
12/17/2013,9:20:00,12/17/2013 9:20,SHR,SHR_2013-12-17 09:20:00,0,65,10,180.1719109,0.153846154,0.069746499,314.159,0.348732495,NA,5,90.08595543,Moderate sediment.,2,2,Monoraphidium contortum,Monoraphidium,contortum,NA,Soft Body,i,2 cones,40.7,NA,NA,54.55475755,NA,NA,NA,NA,NA,NA,NA,NA,NA,NA,NA,NA,NA,NA,NA,NA,NA,NA,NA,NA,NA,NA,NA,NA,NA,NA,NA,NA,NA,NA,NA,NA,NA,NA,NA
12/17/2013,9:20:00,12/17/2013 9:20,SHR,SHR_2013-12-17 09:20:00,0,65,10,270.2578663,0.153846154,0.069746499,314.159,0.348732495,NA,5,90.08595543,Moderate sediment.,3,3,Plagioselmis nannoplanctica,Plagioselmis,nannoplanctica,NA,Soft Body,i,cone + half sphere,8.3,NA,NA,216.4241351,NA,NA,NA,NA,NA,NA,NA,NA,NA,NA,NA,NA,NA,NA,NA,NA,NA,NA,NA,NA,NA,NA,NA,NA,NA,NA,NA,NA,NA,NA,NA,NA,NA,NA,NA
12/17/2013,9:20:00,12/17/2013 9:20,SHR,SHR_2013-12-17 09:20:00,0,65,10,180.1719109,0.153846154,0.069746499,314.159,0.348732495,NA,5,90.08595543,Moderate sediment.,2,2,Plagioselmis lacustris,Plagioselmis,lacustris,NA,Soft Body,i,cone + half sphere,13,NA,NA,862.7591538,NA,NA,NA,NA,NA,NA,NA,NA,NA,NA,NA,NA,NA,NA,NA,NA,NA,NA,NA,NA,NA,NA,NA,NA,NA,NA,NA,NA,NA,NA,NA,NA,NA,NA,NA
12/17/2013,9:20:00,12/17/2013 9:20,SHR,SHR_2013-12-17 09:20:00,0,65,10,53961.4873,0.153846154,0.069746499,314.159,0.348732495,NA,5,90.08595543,Moderate sediment.,599,1337,Chroococcus microscopicus,Chroococcus,microscopicus,NA,Soft Body,c,sphere,0.8,NA,NA,0.268082347,NA,NA,NA,NA,NA,NA,NA,NA,NA,NA,NA,NA,NA,NA,NA,NA,NA,NA,NA,NA,NA,NA,NA,NA,NA,NA,NA,NA,NA,NA,NA,NA,NA,NA,NA
12/17/2013,9:20:00,12/17/2013 9:20,SHR,SHR_2013-12-17 09:20:00,0,65,10,90.08595543,0.153846154,0.069746499,314.159,0.348732495,NA,5,90.08595543,Moderate sediment.,1,11,cf. Geitlerinema sp.,Geitlerinema,sp.,NA,Soft Body,f,cylinder,1.5,NA,NA,0.954257963,NA,NA,NA,NA,NA,NA,NA,NA,NA,NA,NA,NA,NA,NA,NA,NA,NA,NA,NA,NA,NA,NA,NA,NA,NA,NA,NA,NA,NA,NA,NA,NA,NA,NA,NA
12/17/2013,9:20:00,12/17/2013 9:20,SHR,SHR_2013-12-17 09:20:00,0,65,10,270.2578663,0.153846154,0.069746499,314.159,0.348732495,NA,5,90.08595543,Moderate sediment.,3,25,cf. Glaucospira sp.,Glaucospira,sp.,NA,Soft Body,f,cylinder,0.8,NA,NA,0.40212352,NA,NA,NA,NA,NA,NA,NA,NA,NA,NA,NA,NA,NA,NA,NA,NA,NA,NA,NA,NA,NA,NA,NA,NA,NA,NA,NA,NA,NA,NA,NA,NA,NA,NA,NA
12/17/2013,9:20:00,12/17/2013 9:20,SHR,SHR_2013-12-17 09:20:00,0,65,10,270.2578663,0.153846154,0.069746499,314.159,0.348732495,NA,5,90.08595543,Moderate sediment.,3,36,Planktolyngbya sp.,Planktolyngbya,sp.,NA,Soft Body,f,cylinder,0.9,NA,NA,0.346360298,NA,NA,NA,NA,NA,NA,NA,NA,NA,NA,NA,NA,NA,NA,NA,NA,NA,NA,NA,NA,NA,NA,NA,NA,NA,NA,NA,NA,NA,NA,NA,NA,NA,NA,NA
12/17/2013,12:44:00,12/17/2013 12:44,LIS,LIS_2013-12-17 12:44:00,0,61,5,180.1719109,0.081967213,0.069746499,314.159,0.348732495,NA,5,180.1719109,Moderate sediment.,1,1,Cocconeis placentula,Cocconeis,placentula,NA,Diatom,i,elliptic prism,29.6,NA,NA,1591.309583,NA,NA,NA,NA,NA,NA,NA,NA,NA,NA,NA,NA,NA,NA,NA,NA,NA,NA,NA,NA,NA,NA,NA,NA,NA,NA,NA,NA,NA,NA,NA,NA,NA,NA,NA
12/17/2013,12:44:00,12/17/2013 12:44,LIS,LIS_2013-12-17 12:44:00,0,61,5,180.1719109,0.081967213,0.069746499,314.159,0.348732495,NA,5,180.1719109,Girdle view. Moderate sediment.,1,1,Nitzschia sp.,Nitzschia,sp.,NA,Diatom,i,prism on parallelogram,22.2,NA,NA,87.024,NA,NA,NA,NA,NA,NA,NA,NA,NA,NA,NA,NA,NA,NA,NA,NA,NA,NA,NA,NA,NA,NA,NA,NA,NA,NA,NA,NA,NA,NA,NA,NA,NA,NA,NA
12/17/2013,12:44:00,12/17/2013 12:44,LIS,LIS_2013-12-17 12:44:00,0,61,5,720.6876434,0.081967213,0.069746499,314.159,0.348732495,NA,5,180.1719109,Moderate sediment.,4,4,cf. Thalassiosira sp.,Thalassiosira,sp.,NA,Diatom,i,cylinder,12,NA,NA,633.344544,NA,NA,NA,NA,NA,NA,NA,NA,NA,NA,NA,NA,NA,NA,NA,NA,NA,NA,NA,NA,NA,NA,NA,NA,NA,NA,NA,NA,NA,NA,NA,NA,NA,NA,NA
12/17/2013,12:44:00,12/17/2013 12:44,LIS,LIS_2013-12-17 12:44:00,0,61,5,180.1719109,0.081967213,0.069746499,314.159,0.348732495,NA,5,180.1719109,Moderate sediment.,1,1,Ankistrodesmus nannoselene,Ankistrodesmus,nannoselene,NA,Soft Body,i,cylinder + 2 cones,5.6,NA,NA,18.00405959,NA,NA,NA,NA,NA,NA,NA,NA,NA,NA,NA,NA,NA,NA,NA,NA,NA,NA,NA,NA,NA,NA,NA,NA,NA,NA,NA,NA,NA,NA,NA,NA,NA,NA,NA
12/17/2013,12:44:00,12/17/2013 12:44,LIS,LIS_2013-12-17 12:44:00,0,61,5,540.5157326,0.081967213,0.069746499,314.159,0.348732495,NA,5,180.1719109,Moderate sediment.,3,3,Chlamydomonas sp.,Chlamydomonas,sp.,NA,Soft Body,i,sphere,4.6,NA,NA,50.96496737,NA,NA,NA,NA,NA,NA,NA,NA,NA,NA,NA,NA,NA,NA,NA,NA,NA,NA,NA,NA,NA,NA,NA,NA,NA,NA,NA,NA,NA,NA,NA,NA,NA,NA,NA
12/17/2013,12:44:00,12/17/2013 12:44,LIS,LIS_2013-12-17 12:44:00,0,61,5,180.1719109,0.081967213,0.069746499,314.159,0.348732495,NA,5,180.1719109,Moderate sediment.,1,1,Monoraphidium contortum,Monoraphidium,contortum,NA,Soft Body,i,2 cones,29.6,NA,NA,55.94962351,NA,NA,NA,NA,NA,NA,NA,NA,NA,NA,NA,NA,NA,NA,NA,NA,NA,NA,NA,NA,NA,NA,NA,NA,NA,NA,NA,NA,NA,NA,NA,NA,NA,NA,NA
12/17/2013,12:44:00,12/17/2013 12:44,LIS,LIS_2013-12-17 12:44:00,0,61,5,360.3438217,0.081967213,0.069746499,314.159,0.348732495,NA,5,180.1719109,Moderate sediment.,2,2,Cryptomonas ovata,Cryptomonas,ovata,NA,Soft Body,i,prolate spheroid,51.9,NA,NA,7578.767004,NA,NA,NA,NA,NA,NA,NA,NA,NA,NA,NA,NA,NA,NA,NA,NA,NA,NA,NA,NA,NA,NA,NA,NA,NA,NA,NA,NA,NA,NA,NA,NA,NA,NA,NA
12/17/2013,12:44:00,12/17/2013 12:44,LIS,LIS_2013-12-17 12:44:00,0,61,5,180.1719109,0.081967213,0.069746499,314.159,0.348732495,NA,5,180.1719109,Moderate sediment.,1,1,Plagioselmis nannoplanctica,Plagioselmis,nannoplanctica,NA,Soft Body,i,cone + half sphere,9.3,NA,NA,335.1165469,NA,NA,NA,NA,NA,NA,NA,NA,NA,NA,NA,NA,NA,NA,NA,NA,NA,NA,NA,NA,NA,NA,NA,NA,NA,NA,NA,NA,NA,NA,NA,NA,NA,NA,NA
12/17/2013,12:44:00,12/17/2013 12:44,LIS,LIS_2013-12-17 12:44:00,0,61,5,71348.0767,0.081967213,0.069746499,314.159,0.348732495,NA,5,180.1719109,Moderate sediment.,396,824,Chroococcus microscopicus,Chroococcus,microscopicus,NA,Soft Body,c,sphere,0.8,NA,NA,0.268082347,NA,NA,NA,NA,NA,NA,NA,NA,NA,NA,NA,NA,NA,NA,NA,NA,NA,NA,NA,NA,NA,NA,NA,NA,NA,NA,NA,NA,NA,NA,NA,NA,NA,NA,NA
12/17/2013,12:44:00,12/17/2013 12:44,LIS,LIS_2013-12-17 12:44:00,0,61,5,180.1719109,0.081967213,0.069746499,314.159,0.348732495,NA,5,180.1719109,Moderate sediment.,1,2,Chroococcus minimus,Chroococcus,minimus,NA,Soft Body,c,sphere,1.9,NA,NA,3.591360968,NA,NA,NA,NA,NA,NA,NA,NA,NA,NA,NA,NA,NA,NA,NA,NA,NA,NA,NA,NA,NA,NA,NA,NA,NA,NA,NA,NA,NA,NA,NA,NA,NA,NA,NA
12/17/2013,12:44:00,12/17/2013 12:44,LIS,LIS_2013-12-17 12:44:00,0,61,5,180.1719109,0.081967213,0.069746499,314.159,0.348732495,NA,5,180.1719109,Moderate sediment.,1,16,cf. Planktolyngbya sp.,Planktolyngbya,sp.,NA,Soft Body,f,cylinder,0.9,NA,NA,0.572554778,NA,NA,NA,NA,NA,NA,NA,NA,NA,NA,NA,NA,NA,NA,NA,NA,NA,NA,NA,NA,NA,NA,NA,NA,NA,NA,NA,NA,NA,NA,NA,NA,NA,NA,NA
12/18/2013,9:15:00,12/18/2013 9:15,STTD,STTD_2013-12-18 09:15:00,0,65,5,180.1719109,0.076923077,0.069746499,314.159,0.348732495,NA,5,180.1719109,High sediment.,1,1,Achnanthidium minutissimum,Achnanthidium,minutissimum,NA,Diatom,i,elliptic prism,9.3,NA,NA,29.216787,NA,NA,NA,NA,NA,NA,NA,NA,NA,NA,NA,NA,NA,NA,NA,NA,NA,NA,NA,NA,NA,NA,NA,NA,NA,NA,NA,NA,NA,NA,NA,NA,NA,NA,NA
12/18/2013,9:15:00,12/18/2013 9:15,STTD,STTD_2013-12-18 09:15:00,0,65,5,180.1719109,0.076923077,0.069746499,314.159,0.348732495,NA,5,180.1719109,Girdle view. High sediment.,1,1,cf. Cyclotella sp.,Cyclotella,sp.,NA,Diatom,i,cylinder,6.5,NA,NA,122.7772642,NA,NA,NA,NA,NA,NA,NA,NA,NA,NA,NA,NA,NA,NA,NA,NA,NA,NA,NA,NA,NA,NA,NA,NA,NA,NA,NA,NA,NA,NA,NA,NA,NA,NA,NA
12/18/2013,9:15:00,12/18/2013 9:15,STTD,STTD_2013-12-18 09:15:00,0,65,5,180.1719109,0.076923077,0.069746499,314.159,0.348732495,NA,5,180.1719109,Girdle view. High sediment.,1,1,cf. Hippodonta sp.,Hippodonta,sp.,NA,Diatom,i,elliptic prism,22.2,NA,NA,234.3374813,NA,NA,NA,NA,NA,NA,NA,NA,NA,NA,NA,NA,NA,NA,NA,NA,NA,NA,NA,NA,NA,NA,NA,NA,NA,NA,NA,NA,NA,NA,NA,NA,NA,NA,NA
12/18/2013,9:15:00,12/18/2013 9:15,STTD,STTD_2013-12-18 09:15:00,0,65,5,180.1719109,0.076923077,0.069746499,314.159,0.348732495,NA,5,180.1719109,High sediment.,1,1,Chlamydomonas sp.,Chlamydomonas,sp.,NA,Soft Body,i,sphere,5.6,NA,NA,91.95224491,NA,NA,NA,NA,NA,NA,NA,NA,NA,NA,NA,NA,NA,NA,NA,NA,NA,NA,NA,NA,NA,NA,NA,NA,NA,NA,NA,NA,NA,NA,NA,NA,NA,NA,NA
12/18/2013,9:15:00,12/18/2013 9:15,STTD,STTD_2013-12-18 09:15:00,0,65,5,360.3438217,0.076923077,0.069746499,314.159,0.348732495,NA,5,180.1719109,High sediment.,2,2,Monoraphidium minutum,Monoraphidium,minutum,NA,Soft Body,i,2 cones,9.3,NA,NA,14.07275241,NA,NA,NA,NA,NA,NA,NA,NA,NA,NA,NA,NA,NA,NA,NA,NA,NA,NA,NA,NA,NA,NA,NA,NA,NA,NA,NA,NA,NA,NA,NA,NA,NA,NA,NA
12/18/2013,9:15:00,12/18/2013 9:15,STTD,STTD_2013-12-18 09:15:00,0,65,5,1081.031465,0.076923077,0.069746499,314.159,0.348732495,NA,5,180.1719109,High sediment.,6,6,Plagioselmis nannoplanctica,Plagioselmis,nannoplanctica,NA,Soft Body,i,cone + half sphere,11.1,NA,NA,535.4541704,NA,NA,NA,NA,NA,NA,NA,NA,NA,NA,NA,NA,NA,NA,NA,NA,NA,NA,NA,NA,NA,NA,NA,NA,NA,NA,NA,NA,NA,NA,NA,NA,NA,NA,NA
12/18/2013,9:15:00,12/18/2013 9:15,STTD,STTD_2013-12-18 09:15:00,0,65,5,93869.56555,0.076923077,0.069746499,314.159,0.348732495,NA,5,180.1719109,High sediment.,521,1065,Chroococcus microscopicus,Chroococcus,microscopicus,NA,Soft Body,c,sphere,0.8,NA,NA,0.268082347,NA,NA,NA,NA,NA,NA,NA,NA,NA,NA,NA,NA,NA,NA,NA,NA,NA,NA,NA,NA,NA,NA,NA,NA,NA,NA,NA,NA,NA,NA,NA,NA,NA,NA,NA
1/2/2014,10:07:00,1/2/2014 10:07,STTD,STTD_2014-01-02 10:07:00,0,62,3,844.5558321,0.048387097,0.069746499,314.159,1.115943984,NA,16,93.8395369,Low sediment and high detritus.,9,9,Cyclotella sp.,Cyclotella,sp.,NA,Diatom,i,cylinder,9.3,NA,NA,271.7161191,NA,NA,NA,NA,NA,NA,NA,NA,NA,NA,NA,NA,NA,NA,NA,NA,NA,NA,NA,NA,NA,NA,NA,NA,NA,NA,NA,NA,NA,NA,NA,NA,NA,NA,NA
1/2/2014,10:07:00,1/2/2014 10:07,STTD,STTD_2014-01-02 10:07:00,0,62,3,93.8395369,0.048387097,0.069746499,314.159,1.115943984,NA,16,93.8395369,Low sediment and high detritus.,1,1,Encyonema sp.,Encyonema,sp.,NA,Diatom,i,cymbelloid,20,NA,NA,197.3676259,NA,NA,NA,NA,NA,NA,NA,NA,NA,NA,NA,NA,NA,NA,NA,NA,NA,NA,NA,NA,NA,NA,NA,NA,NA,NA,NA,NA,NA,NA,NA,NA,NA,NA,NA
1/2/2014,10:07:00,1/2/2014 10:07,STTD,STTD_2014-01-02 10:07:00,0,62,3,93.8395369,0.048387097,0.069746499,314.159,1.115943984,NA,16,93.8395369,Low sediment and high detritus.,1,1,Navicula sp.,Navicula,sp.,NA,Diatom,i,elliptic prism,15,NA,NA,174.358245,NA,NA,NA,NA,NA,NA,NA,NA,NA,NA,NA,NA,NA,NA,NA,NA,NA,NA,NA,NA,NA,NA,NA,NA,NA,NA,NA,NA,NA,NA,NA,NA,NA,NA,NA
1/2/2014,10:07:00,1/2/2014 10:07,STTD,STTD_2014-01-02 10:07:00,0,62,3,281.5186107,0.048387097,0.069746499,314.159,1.115943984,NA,16,93.8395369,Low sediment and high detritus.,3,3,Nitzschia acicularis,Nitzschia,acicularis,NA,Diatom,i,prism on parallelogram,56,NA,NA,84,NA,NA,NA,NA,NA,NA,NA,NA,NA,NA,NA,NA,NA,NA,NA,NA,NA,NA,NA,NA,NA,NA,NA,NA,NA,NA,NA,NA,NA,NA,NA,NA,NA,NA,NA
1/2/2014,10:07:00,1/2/2014 10:07,STTD,STTD_2014-01-02 10:07:00,0,62,3,93.8395369,0.048387097,0.069746499,314.159,1.115943984,NA,16,93.8395369,Low sediment and high detritus.,1,1,Nitzschia palea,Nitzschia,palea,NA,Diatom,i,prism on parallelogram,31.5,NA,NA,116.55,NA,NA,NA,NA,NA,NA,NA,NA,NA,NA,NA,NA,NA,NA,NA,NA,NA,NA,NA,NA,NA,NA,NA,NA,NA,NA,NA,NA,NA,NA,NA,NA,NA,NA,NA
1/2/2014,10:07:00,1/2/2014 10:07,STTD,STTD_2014-01-02 10:07:00,0,62,3,375.3581476,0.048387097,0.069746499,314.159,1.115943984,NA,16,93.8395369,Low sediment and high detritus.,4,4,Nitzschia spp.,Nitzschia,spp.,NA,Diatom,i,prism on parallelogram,26,NA,NA,218.4,NA,NA,NA,NA,NA,NA,NA,NA,NA,NA,NA,NA,NA,NA,NA,NA,NA,NA,NA,NA,NA,NA,NA,NA,NA,NA,NA,NA,NA,NA,NA,NA,NA,NA,NA
1/2/2014,10:07:00,1/2/2014 10:07,STTD,STTD_2014-01-02 10:07:00,0,62,3,844.5558321,0.048387097,0.069746499,314.159,1.115943984,NA,16,93.8395369,Low sediment and high detritus.,9,9,Chlorella sp.,Chlorella,sp.,NA,Soft Body,i,sphere,3.7,NA,NA,26.52182638,NA,NA,NA,NA,NA,NA,NA,NA,NA,NA,NA,NA,NA,NA,NA,NA,NA,NA,NA,NA,NA,NA,NA,NA,NA,NA,NA,NA,NA,NA,NA,NA,NA,NA,NA
1/2/2014,10:07:00,1/2/2014 10:07,STTD,STTD_2014-01-02 10:07:00,0,62,3,1313.753517,0.048387097,0.069746499,314.159,1.115943984,NA,16,93.8395369,Low sediment and high detritus.,14,14,Monoraphidium contortum,Monoraphidium,contortum,NA,Soft Body,i,2 cones,22,NA,NA,11.51916333,NA,NA,NA,NA,NA,NA,NA,NA,NA,NA,NA,NA,NA,NA,NA,NA,NA,NA,NA,NA,NA,NA,NA,NA,NA,NA,NA,NA,NA,NA,NA,NA,NA,NA,NA
1/2/2014,10:07:00,1/2/2014 10:07,STTD,STTD_2014-01-02 10:07:00,0,62,3,3190.544255,0.048387097,0.069746499,314.159,1.115943984,NA,16,93.8395369,Low sediment and high detritus.,34,34,Chrysococcus sp.,Chrysococcus,sp.,NA,Soft Body,i,prolate spheroid,5.6,NA,NA,73.30376667,NA,NA,NA,NA,NA,NA,NA,NA,NA,NA,NA,NA,NA,NA,NA,NA,NA,NA,NA,NA,NA,NA,NA,NA,NA,NA,NA,NA,NA,NA,NA,NA,NA,NA,NA
1/2/2014,10:07:00,1/2/2014 10:07,STTD,STTD_2014-01-02 10:07:00,0,62,3,187.6790738,0.048387097,0.069746499,314.159,1.115943984,NA,16,93.8395369,Low sediment and high detritus.,2,2,Cryptomonas ovata,Cryptomonas,ovata,NA,Soft Body,i,prolate spheroid,37,NA,NA,4358.956125,NA,NA,NA,NA,NA,NA,NA,NA,NA,NA,NA,NA,NA,NA,NA,NA,NA,NA,NA,NA,NA,NA,NA,NA,NA,NA,NA,NA,NA,NA,NA,NA,NA,NA,NA
1/2/2014,10:07:00,1/2/2014 10:07,STTD,STTD_2014-01-02 10:07:00,0,62,3,187.6790738,0.048387097,0.069746499,314.159,1.115943984,NA,16,93.8395369,Low sediment and high detritus.,2,2,Plagioselmis nannoplanctica,Plagioselmis,nannoplanctica,NA,Soft Body,i,N/A,4,NA,NA,33.51029333,NA,NA,NA,NA,NA,NA,NA,NA,NA,NA,NA,NA,NA,NA,NA,NA,NA,NA,NA,NA,NA,NA,NA,NA,NA,NA,NA,NA,NA,NA,NA,NA,NA,NA,NA
1/2/2014,10:07:00,1/2/2014 10:07,STTD,STTD_2014-01-02 10:07:00,0,62,3,29277.93551,0.048387097,0.069746499,314.159,1.115943984,NA,16,93.8395369,Low sediment and high detritus.,312,710,Chroococcus microscopicus,Chroococcus,microscopicus,NA,Soft Body,c,sphere,0.75,NA,NA,0.22,0.22,0.22,0.22,0.22,0.22,0.22,0.22,0.22,0.22,NA,NA,NA,NA,NA,NA,NA,NA,NA,NA,NA,NA,NA,NA,NA,NA,NA,NA,NA,NA,NA,NA,NA,NA,NA,NA
1/2/2014,10:07:00,1/2/2014 10:07,STTD,STTD_2014-01-02 10:07:00,0,62,3,281.5186107,0.048387097,0.069746499,314.159,1.115943984,NA,16,93.8395369,Low sediment and high detritus.,3,3,Trachelomonas sp.,Trachelomonas,sp.,NA,Soft Body,i,ellipsoid,11,NA,NA,482.0769855,NA,NA,NA,NA,NA,NA,NA,NA,NA,NA,NA,NA,NA,NA,NA,NA,NA,NA,NA,NA,NA,NA,NA,NA,NA,NA,NA,NA,NA,NA,NA,NA,NA,NA,NA
1/2/2014,11:50:00,1/2/2014 11:50,LIS,LIS_2014-01-02 11:50:00,0,65,3,281.5186107,0.046153846,0.069746499,314.159,2.231887968,NA,32,46.91976845,Low sediment and high detritus.,6,6,Cyclotella sp.,Cyclotella,sp.,NA,Diatom,i,cylinder,7.4,NA,NA,129.0251013,NA,NA,NA,NA,NA,NA,NA,NA,NA,NA,NA,NA,NA,NA,NA,NA,NA,NA,NA,NA,NA,NA,NA,NA,NA,NA,NA,NA,NA,NA,NA,NA,NA,NA,NA
1/2/2014,11:50:00,1/2/2014 11:50,LIS,LIS_2014-01-02 11:50:00,0,65,3,46.91976845,0.046153846,0.069746499,314.159,2.231887968,NA,32,46.91976845,Low sediment and high detritus.,1,1,Navicula sp.,Navicula,sp.,NA,Diatom,i,elliptic prism,41,NA,NA,901.63633,NA,NA,NA,NA,NA,NA,NA,NA,NA,NA,NA,NA,NA,NA,NA,NA,NA,NA,NA,NA,NA,NA,NA,NA,NA,NA,NA,NA,NA,NA,NA,NA,NA,NA,NA
1/2/2014,11:50:00,1/2/2014 11:50,LIS,LIS_2014-01-02 11:50:00,0,65,3,234.5988423,0.046153846,0.069746499,314.159,2.231887968,NA,32,46.91976845,Low sediment and high detritus.,5,5,Nitzschia acicularis,Nitzschia,acicularis,NA,Diatom,i,prism on parallelogram,74,NA,NA,273.8,NA,NA,NA,NA,NA,NA,NA,NA,NA,NA,NA,NA,NA,NA,NA,NA,NA,NA,NA,NA,NA,NA,NA,NA,NA,NA,NA,NA,NA,NA,NA,NA,NA,NA,NA
1/2/2014,11:50:00,1/2/2014 11:50,LIS,LIS_2014-01-02 11:50:00,0,65,3,234.5988423,0.046153846,0.069746499,314.159,2.231887968,NA,32,46.91976845,Low sediment and high detritus.,5,5,Nitzschia spp.,Nitzschia,spp.,NA,Diatom,i,prism on parallelogram,13,NA,NA,39,NA,NA,NA,NA,NA,NA,NA,NA,NA,NA,NA,NA,NA,NA,NA,NA,NA,NA,NA,NA,NA,NA,NA,NA,NA,NA,NA,NA,NA,NA,NA,NA,NA,NA,NA
1/2/2014,11:50:00,1/2/2014 11:50,LIS,LIS_2014-01-02 11:50:00,0,65,3,93.8395369,0.046153846,0.069746499,314.159,2.231887968,NA,32,46.91976845,Low sediment and high detritus.,2,2,Chlamydomonas globosa,Chlamydomonas,globosa,NA,Soft Body,i,sphere,5.6,NA,NA,82.10021867,NA,NA,NA,NA,NA,NA,NA,NA,NA,NA,NA,NA,NA,NA,NA,NA,NA,NA,NA,NA,NA,NA,NA,NA,NA,NA,NA,NA,NA,NA,NA,NA,NA,NA,NA
1/2/2014,11:50:00,1/2/2014 11:50,LIS,LIS_2014-01-02 11:50:00,0,65,3,93.8395369,0.046153846,0.069746499,314.159,2.231887968,NA,32,46.91976845,Low sediment and high detritus.,2,2,Chlorella sp.,Chlorella,sp.,NA,Soft Body,i,sphere,3.7,NA,NA,26.52182638,NA,NA,NA,NA,NA,NA,NA,NA,NA,NA,NA,NA,NA,NA,NA,NA,NA,NA,NA,NA,NA,NA,NA,NA,NA,NA,NA,NA,NA,NA,NA,NA,NA,NA,NA
1/2/2014,11:50:00,1/2/2014 11:50,LIS,LIS_2014-01-02 11:50:00,0,65,3,328.4383792,0.046153846,0.069746499,314.159,2.231887968,NA,32,46.91976845,Low sediment and high detritus.,7,7,Monoraphidium contortum,Monoraphidium,contortum,NA,Soft Body,i,2 cones,15,NA,NA,7.853975,NA,NA,NA,NA,NA,NA,NA,NA,NA,NA,NA,NA,NA,NA,NA,NA,NA,NA,NA,NA,NA,NA,NA,NA,NA,NA,NA,NA,NA,NA,NA,NA,NA,NA,NA
1/2/2014,11:50:00,1/2/2014 11:50,LIS,LIS_2014-01-02 11:50:00,0,65,3,797.6360637,0.046153846,0.069746499,314.159,2.231887968,NA,32,46.91976845,Low sediment and high detritus.,17,17,Chrysococcus sp.,Chrysococcus,sp.,NA,Soft Body,i,prolate spheroid,5.6,NA,NA,91.95224491,NA,NA,NA,NA,NA,NA,NA,NA,NA,NA,NA,NA,NA,NA,NA,NA,NA,NA,NA,NA,NA,NA,NA,NA,NA,NA,NA,NA,NA,NA,NA,NA,NA,NA,NA
1/2/2014,11:50:00,1/2/2014 11:50,LIS,LIS_2014-01-02 11:50:00,0,65,3,93.8395369,0.046153846,0.069746499,314.159,2.231887968,NA,32,46.91976845,Low sediment and high detritus.,2,2,Dinobryon sp.,Dinobryon,sp.,NA,Soft Body,c,prolate spheroid,37,NA,NA,1060.873055,NA,NA,NA,NA,NA,NA,NA,NA,NA,NA,NA,NA,NA,NA,NA,NA,NA,NA,NA,NA,NA,NA,NA,NA,NA,NA,NA,NA,NA,NA,NA,NA,NA,NA,NA
1/2/2014,11:50:00,1/2/2014 11:50,LIS,LIS_2014-01-02 11:50:00,0,65,3,140.7593054,0.046153846,0.069746499,314.159,2.231887968,NA,32,46.91976845,Low sediment and high detritus.,3,3,Cryptomonas ovata,Cryptomonas,ovata,NA,Soft Body,i,prolate spheroid,28,NA,NA,1773.951153,NA,NA,NA,NA,NA,NA,NA,NA,NA,NA,NA,NA,NA,NA,NA,NA,NA,NA,NA,NA,NA,NA,NA,NA,NA,NA,NA,NA,NA,NA,NA,NA,NA,NA,NA
1/2/2014,11:50:00,1/2/2014 11:50,LIS,LIS_2014-01-02 11:50:00,0,65,3,14451.28868,0.046153846,0.069746499,314.159,2.231887968,NA,32,46.91976845,Low sediment and high detritus.,308,680,Chroococcus microscopicus,Chroococcus,microscopicus,NA,Soft Body,c,sphere,0.75,NA,NA,0.22,0.22,0.22,0.22,0.22,0.22,0.22,0.22,0.22,0.22,NA,NA,NA,NA,NA,NA,NA,NA,NA,NA,NA,NA,NA,NA,NA,NA,NA,NA,NA,NA,NA,NA,NA,NA,NA,NA
1/3/2014,9:30:00,1/3/2014 9:30,SHR,SHR_2014-01-03 09:30:00,0,61,10,64.34711102,0.163934426,0.069746499,314.159,1.952901972,NA,28,16.08677775,Low sediment and moderate detritus.,4,4,Achnanthidium minutissimum,Achnanthidium,minutissimum,NA,Diatom,i,elliptic prism,11,NA,NA,95.89703475,NA,NA,NA,NA,NA,NA,NA,NA,NA,NA,NA,NA,NA,NA,NA,NA,NA,NA,NA,NA,NA,NA,NA,NA,NA,NA,NA,NA,NA,NA,NA,NA,NA,NA,NA
1/3/2014,9:30:00,1/3/2014 9:30,SHR,SHR_2014-01-03 09:30:00,0,61,10,32.17355551,0.163934426,0.069746499,314.159,1.952901972,NA,28,16.08677775,Low sediment and moderate detritus.,2,2,Aulacoseira sp.,Aulacoseira,sp.,NA,Diatom,i,cylinder,28,NA,NA,301.0585697,NA,NA,NA,NA,NA,NA,NA,NA,NA,NA,NA,NA,NA,NA,NA,NA,NA,NA,NA,NA,NA,NA,NA,NA,NA,NA,NA,NA,NA,NA,NA,NA,NA,NA,NA
1/3/2014,9:30:00,1/3/2014 9:30,SHR,SHR_2014-01-03 09:30:00,0,61,10,16.08677775,0.163934426,0.069746499,314.159,1.952901972,NA,28,16.08677775,Low sediment and moderate detritus.,1,1,Bacillaria paxillifera,Bacillaria,paxillifera,NA,Diatom,i,box,95,NA,NA,1425,NA,NA,NA,NA,NA,NA,NA,NA,NA,NA,NA,NA,NA,NA,NA,NA,NA,NA,NA,NA,NA,NA,NA,NA,NA,NA,NA,NA,NA,NA,NA,NA,NA,NA,NA
1/3/2014,9:30:00,1/3/2014 9:30,SHR,SHR_2014-01-03 09:30:00,0,61,10,16.08677775,0.163934426,0.069746499,314.159,1.952901972,NA,28,16.08677775,Low sediment and moderate detritus.,1,1,Cocconeis placentula,Cocconeis,placentula,NA,Diatom,i,elliptic prism,14.8,NA,NA,172.0334684,NA,NA,NA,NA,NA,NA,NA,NA,NA,NA,NA,NA,NA,NA,NA,NA,NA,NA,NA,NA,NA,NA,NA,NA,NA,NA,NA,NA,NA,NA,NA,NA,NA,NA,NA
1/3/2014,9:30:00,1/3/2014 9:30,SHR,SHR_2014-01-03 09:30:00,0,61,10,64.34711102,0.163934426,0.069746499,314.159,1.952901972,NA,28,16.08677775,Low sediment and moderate detritus.,4,4,Cyclotella spp.,Cyclotella,spp.,NA,Diatom,i,cylinder,7.5,NA,NA,132.5358281,NA,NA,NA,NA,NA,NA,NA,NA,NA,NA,NA,NA,NA,NA,NA,NA,NA,NA,NA,NA,NA,NA,NA,NA,NA,NA,NA,NA,NA,NA,NA,NA,NA,NA,NA
1/3/2014,9:30:00,1/3/2014 9:30,SHR,SHR_2014-01-03 09:30:00,0,61,10,16.08677775,0.163934426,0.069746499,314.159,1.952901972,NA,28,16.08677775,Fragment. Low sediment and moderate detritus.,1,1,Cymbella mexicana,Cymbella,mexicana,NA,Diatom,i,cymbelloid,65,NA,NA,913.5312607,NA,NA,NA,NA,NA,NA,NA,NA,NA,NA,NA,NA,NA,NA,NA,NA,NA,NA,NA,NA,NA,NA,NA,NA,NA,NA,NA,NA,NA,NA,NA,NA,NA,NA,NA
1/3/2014,9:30:00,1/3/2014 9:30,SHR,SHR_2014-01-03 09:30:00,0,61,10,16.08677775,0.163934426,0.069746499,314.159,1.952901972,NA,28,16.08677775,Low sediment and moderate detritus.,1,1,Encyonema silesiacum,Encyonema,silesiacum,NA,Diatom,i,cymbelloid,37,NA,NA,573.6007431,NA,NA,NA,NA,NA,NA,NA,NA,NA,NA,NA,NA,NA,NA,NA,NA,NA,NA,NA,NA,NA,NA,NA,NA,NA,NA,NA,NA,NA,NA,NA,NA,NA,NA,NA
1/3/2014,9:30:00,1/3/2014 9:30,SHR,SHR_2014-01-03 09:30:00,0,61,10,16.08677775,0.163934426,0.069746499,314.159,1.952901972,NA,28,16.08677775,Low sediment and moderate detritus.,1,1,Fragilaria tenera,Fragilaria,tenera,NA,Diatom,i,elliptic prism,121,NA,NA,1596.556038,NA,NA,NA,NA,NA,NA,NA,NA,NA,NA,NA,NA,NA,NA,NA,NA,NA,NA,NA,NA,NA,NA,NA,NA,NA,NA,NA,NA,NA,NA,NA,NA,NA,NA,NA
1/3/2014,9:30:00,1/3/2014 9:30,SHR,SHR_2014-01-03 09:30:00,0,61,10,16.08677775,0.163934426,0.069746499,314.159,1.952901972,NA,28,16.08677775,Low sediment and moderate detritus.,1,1,Gomphoneis sp.,Gomphoneis,sp.,NA,Diatom,i,elliptic prism,28,NA,NA,3156.020573,NA,NA,NA,NA,NA,NA,NA,NA,NA,NA,NA,NA,NA,NA,NA,NA,NA,NA,NA,NA,NA,NA,NA,NA,NA,NA,NA,NA,NA,NA,NA,NA,NA,NA,NA
1/3/2014,9:30:00,1/3/2014 9:30,SHR,SHR_2014-01-03 09:30:00,0,61,10,32.17355551,0.163934426,0.069746499,314.159,1.952901972,NA,28,16.08677775,Low sediment and moderate detritus.,2,2,Melosira varians,Melosira,varians,NA,Diatom,i,cylinder,22,NA,NA,4993.557305,NA,NA,NA,NA,NA,NA,NA,NA,NA,NA,NA,NA,NA,NA,NA,NA,NA,NA,NA,NA,NA,NA,NA,NA,NA,NA,NA,NA,NA,NA,NA,NA,NA,NA,NA
1/3/2014,9:30:00,1/3/2014 9:30,SHR,SHR_2014-01-03 09:30:00,0,61,10,80.43388877,0.163934426,0.069746499,314.159,1.952901972,NA,28,16.08677775,Low sediment and moderate detritus.,5,5,Navicula gregaria,Navicula,gregaria,NA,Diatom,i,elliptic prism,20.4,NA,NA,179.4476208,NA,NA,NA,NA,NA,NA,NA,NA,NA,NA,NA,NA,NA,NA,NA,NA,NA,NA,NA,NA,NA,NA,NA,NA,NA,NA,NA,NA,NA,NA,NA,NA,NA,NA,NA
1/3/2014,9:30:00,1/3/2014 9:30,SHR,SHR_2014-01-03 09:30:00,0,61,10,16.08677775,0.163934426,0.069746499,314.159,1.952901972,NA,28,16.08677775,Low sediment and moderate detritus.,1,1,Nitzschia acicularis,Nitzschia,acicularis,NA,Diatom,i,prism on parallelogram,62,NA,NA,114.7,NA,NA,NA,NA,NA,NA,NA,NA,NA,NA,NA,NA,NA,NA,NA,NA,NA,NA,NA,NA,NA,NA,NA,NA,NA,NA,NA,NA,NA,NA,NA,NA,NA,NA,NA
1/3/2014,9:30:00,1/3/2014 9:30,SHR,SHR_2014-01-03 09:30:00,0,61,10,112.6074443,0.163934426,0.069746499,314.159,1.952901972,NA,28,16.08677775,Low sediment and moderate detritus.,7,7,Nitzschia palea,Nitzschia,palea,NA,Diatom,i,prism on parallelogram,32,NA,NA,179.2,NA,NA,NA,NA,NA,NA,NA,NA,NA,NA,NA,NA,NA,NA,NA,NA,NA,NA,NA,NA,NA,NA,NA,NA,NA,NA,NA,NA,NA,NA,NA,NA,NA,NA,NA
1/3/2014,9:30:00,1/3/2014 9:30,SHR,SHR_2014-01-03 09:30:00,0,61,10,80.43388877,0.163934426,0.069746499,314.159,1.952901972,NA,28,16.08677775,Low sediment and moderate detritus.,5,5,Nitzschia spp.,Nitzschia,spp.,NA,Diatom,i,prism on parallelogram,18.7,NA,NA,157.08,NA,NA,NA,NA,NA,NA,NA,NA,NA,NA,NA,NA,NA,NA,NA,NA,NA,NA,NA,NA,NA,NA,NA,NA,NA,NA,NA,NA,NA,NA,NA,NA,NA,NA,NA
1/3/2014,9:30:00,1/3/2014 9:30,SHR,SHR_2014-01-03 09:30:00,0,61,10,16.08677775,0.163934426,0.069746499,314.159,1.952901972,NA,28,16.08677775,Low sediment and moderate detritus.,1,1,Planothidium lanceolatum,Planothidium,lanceolatum,NA,Diatom,i,elliptic prism,15,NA,NA,261.5373675,NA,NA,NA,NA,NA,NA,NA,NA,NA,NA,NA,NA,NA,NA,NA,NA,NA,NA,NA,NA,NA,NA,NA,NA,NA,NA,NA,NA,NA,NA,NA,NA,NA,NA,NA
1/3/2014,9:30:00,1/3/2014 9:30,SHR,SHR_2014-01-03 09:30:00,0,61,10,112.6074443,0.163934426,0.069746499,314.159,1.952901972,NA,28,16.08677775,Low sediment and moderate detritus.,7,7,Chlorella sp.,Chlorella,sp.,NA,Soft Body,i,sphere,3.7,NA,NA,26.52182638,NA,NA,NA,NA,NA,NA,NA,NA,NA,NA,NA,NA,NA,NA,NA,NA,NA,NA,NA,NA,NA,NA,NA,NA,NA,NA,NA,NA,NA,NA,NA,NA,NA,NA,NA
1/3/2014,9:30:00,1/3/2014 9:30,SHR,SHR_2014-01-03 09:30:00,0,61,10,48.26033326,0.163934426,0.069746499,314.159,1.952901972,NA,28,16.08677775,Low sediment and moderate detritus.,3,3,Monoraphidium contortum,Monoraphidium,contortum,NA,Soft Body,i,2 cones,35,NA,NA,73.30376667,NA,NA,NA,NA,NA,NA,NA,NA,NA,NA,NA,NA,NA,NA,NA,NA,NA,NA,NA,NA,NA,NA,NA,NA,NA,NA,NA,NA,NA,NA,NA,NA,NA,NA,NA
1/3/2014,9:30:00,1/3/2014 9:30,SHR,SHR_2014-01-03 09:30:00,0,61,10,48.26033326,0.163934426,0.069746499,314.159,1.952901972,NA,28,16.08677775,Low sediment and moderate detritus.,3,3,Chrysococcus sp.,Chrysococcus,sp.,NA,Soft Body,i,prolate spheroid,5.6,NA,NA,62.04430811,NA,NA,NA,NA,NA,NA,NA,NA,NA,NA,NA,NA,NA,NA,NA,NA,NA,NA,NA,NA,NA,NA,NA,NA,NA,NA,NA,NA,NA,NA,NA,NA,NA,NA,NA
1/3/2014,9:30:00,1/3/2014 9:30,SHR,SHR_2014-01-03 09:30:00,0,61,10,16.08677775,0.163934426,0.069746499,314.159,1.952901972,NA,28,16.08677775,Low sediment and moderate detritus.,1,1,Mallomonas sp.,Mallomonas,sp.,NA,Soft Body,i,prolate spheroid,20.6,NA,NA,606.7195688,NA,NA,NA,NA,NA,NA,NA,NA,NA,NA,NA,NA,NA,NA,NA,NA,NA,NA,NA,NA,NA,NA,NA,NA,NA,NA,NA,NA,NA,NA,NA,NA,NA,NA,NA
1/3/2014,9:30:00,1/3/2014 9:30,SHR,SHR_2014-01-03 09:30:00,0,61,10,144.7809998,0.163934426,0.069746499,314.159,1.952901972,NA,28,16.08677775,Low sediment and moderate detritus.,9,9,Plagioselmis nannoplanctica,Plagioselmis,nannoplanctica,NA,Soft Body,i,N/A,8,NA,NA,227.8699947,NA,NA,NA,NA,NA,NA,NA,NA,NA,NA,NA,NA,NA,NA,NA,NA,NA,NA,NA,NA,NA,NA,NA,NA,NA,NA,NA,NA,NA,NA,NA,NA,NA,NA,NA
1/3/2014,9:30:00,1/3/2014 9:30,SHR,SHR_2014-01-03 09:30:00,0,61,10,6692.099546,0.163934426,0.069746499,314.159,1.952901972,NA,28,16.08677775,Low sediment and moderate detritus.,416,924,Chroococcus microscopicus,Chroococcus,microscopicus,NA,Soft Body,c,sphere,0.75,NA,NA,0.22,0.22,0.22,0.22,0.22,0.22,0.22,0.22,0.22,0.22,NA,NA,NA,NA,NA,NA,NA,NA,NA,NA,NA,NA,NA,NA,NA,NA,NA,NA,NA,NA,NA,NA,NA,NA,NA,NA
1/3/2014,9:30:00,1/3/2014 9:30,SHR,SHR_2014-01-03 09:30:00,0,61,10,16.08677775,0.163934426,0.069746499,314.159,1.952901972,NA,28,16.08677775,Low sediment and moderate detritus.,1,1,Euglena sp.,Euglena,sp.,NA,Soft Body,i,half ellipsoid + cone on an elliptic base,65,NA,NA,2848.636733,NA,NA,NA,NA,NA,NA,NA,NA,NA,NA,NA,NA,NA,NA,NA,NA,NA,NA,NA,NA,NA,NA,NA,NA,NA,NA,NA,NA,NA,NA,NA,NA,NA,NA,NA
1/28/2014,9:35:00,1/28/2014 9:35,SHR,SHR_2014-01-28 09:35:00,0,64,10,225.2148886,0.15625,0.069746499,314.159,0.418478994,NA,6,75.07162952,Girdle view. Low sediment and detritus.,3,3,Achnanthidium cf. minutissimum,Achnanthidium,minutissimum,NA,Diatom,i,elliptic prism,16.7,NA,NA,179.5599326,NA,NA,NA,NA,NA,NA,NA,NA,NA,NA,NA,NA,NA,NA,NA,NA,NA,NA,NA,NA,NA,NA,NA,NA,NA,NA,NA,NA,NA,NA,NA,NA,NA,NA,NA
1/28/2014,9:35:00,1/28/2014 9:35,SHR,SHR_2014-01-28 09:35:00,0,64,10,300.2865181,0.15625,0.069746499,314.159,0.418478994,NA,6,75.07162952,Low sediment and detritus.,4,4,Aulacoseira sp.,Aulacoseira,sp.,NA,Diatom,i,cylinder,16.7,NA,NA,1311.613825,NA,NA,NA,NA,NA,NA,NA,NA,NA,NA,NA,NA,NA,NA,NA,NA,NA,NA,NA,NA,NA,NA,NA,NA,NA,NA,NA,NA,NA,NA,NA,NA,NA,NA,NA
1/28/2014,9:35:00,1/28/2014 9:35,SHR,SHR_2014-01-28 09:35:00,0,64,10,75.07162952,0.15625,0.069746499,314.159,0.418478994,NA,6,75.07162952,Fragment. Low sediment and detritus.,1,1,Cocconeis placentula,Cocconeis,placentula,NA,Diatom,i,elliptic prism,13,NA,NA,211.5546706,NA,NA,NA,NA,NA,NA,NA,NA,NA,NA,NA,NA,NA,NA,NA,NA,NA,NA,NA,NA,NA,NA,NA,NA,NA,NA,NA,NA,NA,NA,NA,NA,NA,NA,NA
1/28/2014,9:35:00,1/28/2014 9:35,SHR,SHR_2014-01-28 09:35:00,0,64,10,2402.292145,0.15625,0.069746499,314.159,0.418478994,NA,6,75.07162952,Low sediment and detritus.,32,32,Cyclotella spp.,Cyclotella,sp.,NA,Diatom,i,cylinder,14.8,NA,NA,963.387423,NA,NA,NA,NA,NA,NA,NA,NA,NA,NA,NA,NA,NA,NA,NA,NA,NA,NA,NA,NA,NA,NA,NA,NA,NA,NA,NA,NA,NA,NA,NA,NA,NA,NA,NA
1/28/2014,9:35:00,1/28/2014 9:35,SHR,SHR_2014-01-28 09:35:00,0,64,10,75.07162952,0.15625,0.069746499,314.159,0.418478994,NA,6,75.07162952,Fragment. Low sediment and detritus.,1,1,Fragilaria mazamaensis,Fragilaria,mazamaensis,NA,Diatom,i,elliptic prism,20.4,NA,NA,331.9780985,NA,NA,NA,NA,NA,NA,NA,NA,NA,NA,NA,NA,NA,NA,NA,NA,NA,NA,NA,NA,NA,NA,NA,NA,NA,NA,NA,NA,NA,NA,NA,NA,NA,NA,NA
1/28/2014,9:35:00,1/28/2014 9:35,SHR,SHR_2014-01-28 09:35:00,0,64,10,75.07162952,0.15625,0.069746499,314.159,0.418478994,NA,6,75.07162952,Fragment. Low sediment and detritus.,1,1,Frustulia sp.,Frustulia,sp.,NA,Diatom,i,elliptic prism,37,NA,NA,1513.429567,NA,NA,NA,NA,NA,NA,NA,NA,NA,NA,NA,NA,NA,NA,NA,NA,NA,NA,NA,NA,NA,NA,NA,NA,NA,NA,NA,NA,NA,NA,NA,NA,NA,NA,NA
1/28/2014,9:35:00,1/28/2014 9:35,SHR,SHR_2014-01-28 09:35:00,0,64,10,75.07162952,0.15625,0.069746499,314.159,0.418478994,NA,6,75.07162952,Girdle view. Low sediment and detritus.,1,1,Gomphonema sp.,Gomphonema,sp.,NA,Diatom,i,gomphonemoid,18.5,NA,NA,320.8082136,NA,NA,NA,NA,NA,NA,NA,NA,NA,NA,NA,NA,NA,NA,NA,NA,NA,NA,NA,NA,NA,NA,NA,NA,NA,NA,NA,NA,NA,NA,NA,NA,NA,NA,NA
1/28/2014,9:35:00,1/28/2014 9:35,SHR,SHR_2014-01-28 09:35:00,0,64,10,75.07162952,0.15625,0.069746499,314.159,0.418478994,NA,6,75.07162952,Girdle view. Low sediment and detritus.,1,1,Navicula sp.,Navicula,sp.,NA,Diatom,i,elliptic prism,27.8,NA,NA,452.4015264,NA,NA,NA,NA,NA,NA,NA,NA,NA,NA,NA,NA,NA,NA,NA,NA,NA,NA,NA,NA,NA,NA,NA,NA,NA,NA,NA,NA,NA,NA,NA,NA,NA,NA,NA
1/28/2014,9:35:00,1/28/2014 9:35,SHR,SHR_2014-01-28 09:35:00,0,64,10,150.143259,0.15625,0.069746499,314.159,0.418478994,NA,6,75.07162952,Low sediment and detritus.,2,2,Nitzschia dissipata,Nitzschia,dissipata,NA,Diatom,i,prism on parallelogram,25.9,NA,NA,220.409,NA,NA,NA,NA,NA,NA,NA,NA,NA,NA,NA,NA,NA,NA,NA,NA,NA,NA,NA,NA,NA,NA,NA,NA,NA,NA,NA,NA,NA,NA,NA,NA,NA,NA,NA
1/28/2014,9:35:00,1/28/2014 9:35,SHR,SHR_2014-01-28 09:35:00,0,64,10,75.07162952,0.15625,0.069746499,314.159,0.418478994,NA,6,75.07162952,Low sediment and detritus.,1,1,Nitzschia linearis,Nitzschia,linearis,NA,Diatom,i,prism on parallelogram,96.3,NA,NA,1995.336,NA,NA,NA,NA,NA,NA,NA,NA,NA,NA,NA,NA,NA,NA,NA,NA,NA,NA,NA,NA,NA,NA,NA,NA,NA,NA,NA,NA,NA,NA,NA,NA,NA,NA,NA
1/28/2014,9:35:00,1/28/2014 9:35,SHR,SHR_2014-01-28 09:35:00,0,64,10,150.143259,0.15625,0.069746499,314.159,0.418478994,NA,6,75.07162952,Fragment. Low sediment and detritus.,2,2,Nitzschia spp.,Nitzschia,spp.,NA,Diatom,i,prism on parallelogram,13,NA,NA,134.68,NA,NA,NA,NA,NA,NA,NA,NA,NA,NA,NA,NA,NA,NA,NA,NA,NA,NA,NA,NA,NA,NA,NA,NA,NA,NA,NA,NA,NA,NA,NA,NA,NA,NA,NA
1/28/2014,9:35:00,1/28/2014 9:35,SHR,SHR_2014-01-28 09:35:00,0,64,10,375.3581476,0.15625,0.069746499,314.159,0.418478994,NA,6,75.07162952,Girdle view. Low sediment and detritus.,5,5,Nitzschia spp.,Nitzschia,spp.,NA,Diatom,i,prism on parallelogram,20.4,NA,NA,215.832,NA,NA,NA,NA,NA,NA,NA,NA,NA,NA,NA,NA,NA,NA,NA,NA,NA,NA,NA,NA,NA,NA,NA,NA,NA,NA,NA,NA,NA,NA,NA,NA,NA,NA,NA
1/28/2014,9:35:00,1/28/2014 9:35,SHR,SHR_2014-01-28 09:35:00,0,64,10,75.07162952,0.15625,0.069746499,314.159,0.418478994,NA,6,75.07162952,Low sediment and detritus.,1,1,Rhoicosphenia abbreviata,Rhoicosphenia,abbreviata,NA,Diatom,i,gomphonemoid,9.3,NA,NA,209.1982767,NA,NA,NA,NA,NA,NA,NA,NA,NA,NA,NA,NA,NA,NA,NA,NA,NA,NA,NA,NA,NA,NA,NA,NA,NA,NA,NA,NA,NA,NA,NA,NA,NA,NA,NA
1/28/2014,9:35:00,1/28/2014 9:35,SHR,SHR_2014-01-28 09:35:00,0,64,10,300.2865181,0.15625,0.069746499,314.159,0.418478994,NA,6,75.07162952,Girdle view. Low sediment and detritus.,4,4,cf. Skeletonema sp.,Skeletonema,sp.,NA,Diatom,i,cylinder + 2 half spheres,2.8,NA,NA,11.69928116,NA,NA,NA,NA,NA,NA,NA,NA,NA,NA,NA,NA,NA,NA,NA,NA,NA,NA,NA,NA,NA,NA,NA,NA,NA,NA,NA,NA,NA,NA,NA,NA,NA,NA,NA
1/28/2014,9:35:00,1/28/2014 9:35,SHR,SHR_2014-01-28 09:35:00,0,64,10,375.3581476,0.15625,0.069746499,314.159,0.418478994,NA,6,75.07162952,Low sediment and detritus.,5,5,cf. Staurosira venter,Staurosira,venter,NA,Diatom,c,elliptic prism,6.5,NA,NA,160.0954264,NA,NA,NA,NA,NA,NA,NA,NA,NA,NA,NA,NA,NA,NA,NA,NA,NA,NA,NA,NA,NA,NA,NA,NA,NA,NA,NA,NA,NA,NA,NA,NA,NA,NA,NA
1/28/2014,9:35:00,1/28/2014 9:35,SHR,SHR_2014-01-28 09:35:00,0,64,10,150.143259,0.15625,0.069746499,314.159,0.418478994,NA,6,75.07162952,Fragment. Low sediment and detritus.,2,2,Ulnaria sp.,Ulnaria,sp.,NA,Diatom,i,elliptic prism,18.5,NA,NA,397.8273957,NA,NA,NA,NA,NA,NA,NA,NA,NA,NA,NA,NA,NA,NA,NA,NA,NA,NA,NA,NA,NA,NA,NA,NA,NA,NA,NA,NA,NA,NA,NA,NA,NA,NA,NA
1/28/2014,9:35:00,1/28/2014 9:35,SHR,SHR_2014-01-28 09:35:00,0,64,10,75.07162952,0.15625,0.069746499,314.159,0.418478994,NA,6,75.07162952,Low sediment and detritus.,1,1,Chlamydomonas sp.,Chlamydomonas,sp.,NA,Soft Body,i,sphere,13,NA,NA,702.6637274,NA,NA,NA,NA,NA,NA,NA,NA,NA,NA,NA,NA,NA,NA,NA,NA,NA,NA,NA,NA,NA,NA,NA,NA,NA,NA,NA,NA,NA,NA,NA,NA,NA,NA,NA
1/28/2014,9:35:00,1/28/2014 9:35,SHR,SHR_2014-01-28 09:35:00,0,64,10,3378.223328,0.15625,0.069746499,314.159,0.418478994,NA,6,75.07162952,Low sediment and detritus.,45,45,Chlorella spp.,Chlorella,spp.,NA,Soft Body,i,sphere,5.6,NA,NA,91.95224491,NA,NA,NA,NA,NA,NA,NA,NA,NA,NA,NA,NA,NA,NA,NA,NA,NA,NA,NA,NA,NA,NA,NA,NA,NA,NA,NA,NA,NA,NA,NA,NA,NA,NA,NA
1/28/2014,9:35:00,1/28/2014 9:35,SHR,SHR_2014-01-28 09:35:00,0,64,10,75.07162952,0.15625,0.069746499,314.159,0.418478994,NA,6,75.07162952,Low sediment and detritus.,1,1,Closteriopsis acicularis,Closteriopsis,acicularis,NA,Soft Body,i,cylinder + 2 cones,51.9,NA,NA,149.8448109,NA,NA,NA,NA,NA,NA,NA,NA,NA,NA,NA,NA,NA,NA,NA,NA,NA,NA,NA,NA,NA,NA,NA,NA,NA,NA,NA,NA,NA,NA,NA,NA,NA,NA,NA
1/28/2014,9:35:00,1/28/2014 9:35,SHR,SHR_2014-01-28 09:35:00,0,64,10,75.07162952,0.15625,0.069746499,314.159,0.418478994,NA,6,75.07162952,Low sediment and detritus.,1,1,Monoraphidium arcuatum,Monoraphidium,arcuatum,NA,Soft Body,i,2 cones,27.8,NA,NA,52.54728154,NA,NA,NA,NA,NA,NA,NA,NA,NA,NA,NA,NA,NA,NA,NA,NA,NA,NA,NA,NA,NA,NA,NA,NA,NA,NA,NA,NA,NA,NA,NA,NA,NA,NA,NA
1/28/2014,9:35:00,1/28/2014 9:35,SHR,SHR_2014-01-28 09:35:00,0,64,10,150.143259,0.15625,0.069746499,314.159,0.418478994,NA,6,75.07162952,Low sediment and detritus.,2,2,Monoraphidium contortum,Monoraphidium,contortum,NA,Soft Body,i,2 cones,24.1,NA,NA,45.5535786,NA,NA,NA,NA,NA,NA,NA,NA,NA,NA,NA,NA,NA,NA,NA,NA,NA,NA,NA,NA,NA,NA,NA,NA,NA,NA,NA,NA,NA,NA,NA,NA,NA,NA,NA
1/28/2014,9:35:00,1/28/2014 9:35,SHR,SHR_2014-01-28 09:35:00,0,64,10,375.3581476,0.15625,0.069746499,314.159,0.418478994,NA,6,75.07162952,Low sediment and detritus.,5,5,cf. Pseudoscourfieldia sp.,Pseudoscourfieldia,sp.,NA,Soft Body,i,ellipsoid,3.7,NA,NA,6.993702938,NA,NA,NA,NA,NA,NA,NA,NA,NA,NA,NA,NA,NA,NA,NA,NA,NA,NA,NA,NA,NA,NA,NA,NA,NA,NA,NA,NA,NA,NA,NA,NA,NA,NA,NA
1/28/2014,9:35:00,1/28/2014 9:35,SHR,SHR_2014-01-28 09:35:00,0,64,10,75.07162952,0.15625,0.069746499,314.159,0.418478994,NA,6,75.07162952,Low sediment and detritus.,1,1,Chrysococcus sp.,Chrysococcus,sp.,NA,Soft Body,i,prolate spheroid,5.6,NA,NA,91.95224491,NA,NA,NA,NA,NA,NA,NA,NA,NA,NA,NA,NA,NA,NA,NA,NA,NA,NA,NA,NA,NA,NA,NA,NA,NA,NA,NA,NA,NA,NA,NA,NA,NA,NA,NA
1/28/2014,9:35:00,1/28/2014 9:35,SHR,SHR_2014-01-28 09:35:00,0,64,10,75.07162952,0.15625,0.069746499,314.159,0.418478994,NA,6,75.07162952,Obscured by detritus. Low sediment and detritus.,1,1,Cryptomonas cf. ovata,Cryptomonas,ovata,NA,Soft Body,i,prolate spheroid,20.4,NA,NA,923.8348049,NA,NA,NA,NA,NA,NA,NA,NA,NA,NA,NA,NA,NA,NA,NA,NA,NA,NA,NA,NA,NA,NA,NA,NA,NA,NA,NA,NA,NA,NA,NA,NA,NA,NA,NA
1/28/2014,9:35:00,1/28/2014 9:35,SHR,SHR_2014-01-28 09:35:00,0,64,10,75.07162952,0.15625,0.069746499,314.159,0.418478994,NA,6,75.07162952,Low sediment and detritus.,1,1,Cryptomonas ovata,Cryptomonas,ovata,NA,Soft Body,i,prolate spheroid,20.4,NA,NA,1316.056033,NA,NA,NA,NA,NA,NA,NA,NA,NA,NA,NA,NA,NA,NA,NA,NA,NA,NA,NA,NA,NA,NA,NA,NA,NA,NA,NA,NA,NA,NA,NA,NA,NA,NA,NA
1/28/2014,9:35:00,1/28/2014 9:35,SHR,SHR_2014-01-28 09:35:00,0,64,10,75.07162952,0.15625,0.069746499,314.159,0.418478994,NA,6,75.07162952,Low sediment and detritus.,1,1,Plagioselmis lacustris,Plagioselmis,lacustris,NA,Soft Body,i,cone + half sphere,11.1,NA,NA,567.7104457,NA,NA,NA,NA,NA,NA,NA,NA,NA,NA,NA,NA,NA,NA,NA,NA,NA,NA,NA,NA,NA,NA,NA,NA,NA,NA,NA,NA,NA,NA,NA,NA,NA,NA,NA
1/28/2014,9:35:00,1/28/2014 9:35,SHR,SHR_2014-01-28 09:35:00,0,64,10,150.143259,0.15625,0.069746499,314.159,0.418478994,NA,6,75.07162952,Low sediment and detritus.,2,2,Plagioselmis nannoplanctica,Plagioselmis,nannoplanctica,NA,Soft Body,i,cone + half sphere,9.3,NA,NA,314.737838,NA,NA,NA,NA,NA,NA,NA,NA,NA,NA,NA,NA,NA,NA,NA,NA,NA,NA,NA,NA,NA,NA,NA,NA,NA,NA,NA,NA,NA,NA,NA,NA,NA,NA,NA
1/28/2014,9:35:00,1/28/2014 9:35,SHR,SHR_2014-01-28 09:35:00,0,64,10,20269.33997,0.15625,0.069746499,314.159,0.418478994,NA,6,75.07162952,Low sediment and detritus.,270,584,Chroococcus microscopicus,Chroococcus,microscopicus,NA,Soft Body,c,sphere,0.75,NA,NA,0.22,0.22,0.22,0.22,0.22,0.22,0.22,0.22,0.22,0.22,NA,NA,NA,NA,NA,NA,NA,NA,NA,NA,NA,NA,NA,NA,NA,NA,NA,NA,NA,NA,NA,NA,NA,NA,NA,NA
1/29/2014,9:55:00,1/29/2014 9:55,STTD,STTD_2014-01-29 09:55:00,0,64,3,400.3820241,0.046875,0.069746499,314.159,1.046197485,NA,15,100.095506,Low sediment and high detritus.,4,4,Cyclotella spp.,Cyclotella,spp.,NA,Diatom,i,cylinder,7.5,NA,NA,132.5358281,NA,NA,NA,NA,NA,NA,NA,NA,NA,NA,NA,NA,NA,NA,NA,NA,NA,NA,NA,NA,NA,NA,NA,NA,NA,NA,NA,NA,NA,NA,NA,NA,NA,NA,NA
1/29/2014,9:55:00,1/29/2014 9:55,STTD,STTD_2014-01-29 09:55:00,0,64,3,200.1910121,0.046875,0.069746499,314.159,1.046197485,NA,15,100.095506,Low sediment and high detritus.,2,2,Navicula sp.,Navicula,sp.,NA,Diatom,i,elliptic prism,18.5,NA,NA,244.101543,NA,NA,NA,NA,NA,NA,NA,NA,NA,NA,NA,NA,NA,NA,NA,NA,NA,NA,NA,NA,NA,NA,NA,NA,NA,NA,NA,NA,NA,NA,NA,NA,NA,NA,NA
1/29/2014,9:55:00,1/29/2014 9:55,STTD,STTD_2014-01-29 09:55:00,0,64,3,100.095506,0.046875,0.069746499,314.159,1.046197485,NA,15,100.095506,Low sediment and high detritus.,1,1,cf. Navicula sp.,Navicula,sp.,NA,Diatom,i,elliptic prism,21,NA,NA,62.6747205,NA,NA,NA,NA,NA,NA,NA,NA,NA,NA,NA,NA,NA,NA,NA,NA,NA,NA,NA,NA,NA,NA,NA,NA,NA,NA,NA,NA,NA,NA,NA,NA,NA,NA,NA
1/29/2014,9:55:00,1/29/2014 9:55,STTD,STTD_2014-01-29 09:55:00,0,64,3,100.095506,0.046875,0.069746499,314.159,1.046197485,NA,15,100.095506,Low sediment and high detritus.,1,1,Nitzschia acicularis,Nitzschia,acicularis,NA,Diatom,i,prism on parallelogram,84,NA,NA,310.8,NA,NA,NA,NA,NA,NA,NA,NA,NA,NA,NA,NA,NA,NA,NA,NA,NA,NA,NA,NA,NA,NA,NA,NA,NA,NA,NA,NA,NA,NA,NA,NA,NA,NA,NA
1/29/2014,9:55:00,1/29/2014 9:55,STTD,STTD_2014-01-29 09:55:00,0,64,3,200.1910121,0.046875,0.069746499,314.159,1.046197485,NA,15,100.095506,Low sediment and high detritus.,2,2,Fragilaria brevistriata,Fragilaria,brevistriata,NA,Diatom,i,elliptic prism,18.7,NA,NA,163.0249591,NA,NA,NA,NA,NA,NA,NA,NA,NA,NA,NA,NA,NA,NA,NA,NA,NA,NA,NA,NA,NA,NA,NA,NA,NA,NA,NA,NA,NA,NA,NA,NA,NA,NA,NA
1/29/2014,9:55:00,1/29/2014 9:55,STTD,STTD_2014-01-29 09:55:00,0,64,3,700.6685422,0.046875,0.069746499,314.159,1.046197485,NA,15,100.095506,Low sediment and high detritus.,7,7,Chlorella sp.,Chlorella,sp.,NA,Soft Body,i,sphere,3.7,NA,NA,26.52182638,NA,NA,NA,NA,NA,NA,NA,NA,NA,NA,NA,NA,NA,NA,NA,NA,NA,NA,NA,NA,NA,NA,NA,NA,NA,NA,NA,NA,NA,NA,NA,NA,NA,NA,NA
1/29/2014,9:55:00,1/29/2014 9:55,STTD,STTD_2014-01-29 09:55:00,0,64,3,100.095506,0.046875,0.069746499,314.159,1.046197485,NA,15,100.095506,Low sediment and high detritus.,1,1,Monoraphidium arcuatum,Monoraphidium,arcuatum,NA,Soft Body,i,2 cones,31.5,NA,NA,65.97339,NA,NA,NA,NA,NA,NA,NA,NA,NA,NA,NA,NA,NA,NA,NA,NA,NA,NA,NA,NA,NA,NA,NA,NA,NA,NA,NA,NA,NA,NA,NA,NA,NA,NA,NA
1/29/2014,9:55:00,1/29/2014 9:55,STTD,STTD_2014-01-29 09:55:00,0,64,3,1301.241578,0.046875,0.069746499,314.159,1.046197485,NA,15,100.095506,Low sediment and high detritus.,13,13,Monoraphidium contortum,Monoraphidium,contortum,NA,Soft Body,i,2 cones,18.7,NA,NA,39.16515533,NA,NA,NA,NA,NA,NA,NA,NA,NA,NA,NA,NA,NA,NA,NA,NA,NA,NA,NA,NA,NA,NA,NA,NA,NA,NA,NA,NA,NA,NA,NA,NA,NA,NA,NA
1/29/2014,9:55:00,1/29/2014 9:55,STTD,STTD_2014-01-29 09:55:00,0,64,3,300.2865181,0.046875,0.069746499,314.159,1.046197485,NA,15,100.095506,Low sediment and high detritus.,3,3,Monoraphidium convolutum,Monoraphidium,convolutum,NA,Soft Body,i,2 cones,7.5,NA,NA,15.70795,NA,NA,NA,NA,NA,NA,NA,NA,NA,NA,NA,NA,NA,NA,NA,NA,NA,NA,NA,NA,NA,NA,NA,NA,NA,NA,NA,NA,NA,NA,NA,NA,NA,NA,NA
1/29/2014,9:55:00,1/29/2014 9:55,STTD,STTD_2014-01-29 09:55:00,0,64,3,100.095506,0.046875,0.069746499,314.159,1.046197485,NA,15,100.095506,Low sediment and high detritus.,1,2,Desmodesmus abundans,Desmodesmus,abundans,NA,Soft Body,c,prolate spheroid,7.5,NA,NA,15.70795,NA,NA,NA,NA,NA,NA,NA,NA,NA,NA,NA,NA,NA,NA,NA,NA,NA,NA,NA,NA,NA,NA,NA,NA,NA,NA,NA,NA,NA,NA,NA,NA,NA,NA,NA
1/29/2014,9:55:00,1/29/2014 9:55,STTD,STTD_2014-01-29 09:55:00,0,64,3,2302.196639,0.046875,0.069746499,314.159,1.046197485,NA,15,100.095506,Low sediment and high detritus.,23,23,Chrysococcus sp.,Chrysococcus,sp.,NA,Soft Body,i,prolate spheroid,7.5,NA,NA,123.150328,NA,NA,NA,NA,NA,NA,NA,NA,NA,NA,NA,NA,NA,NA,NA,NA,NA,NA,NA,NA,NA,NA,NA,NA,NA,NA,NA,NA,NA,NA,NA,NA,NA,NA,NA
1/29/2014,9:55:00,1/29/2014 9:55,STTD,STTD_2014-01-29 09:55:00,0,64,3,300.2865181,0.046875,0.069746499,314.159,1.046197485,NA,15,100.095506,Low sediment and high detritus.,3,3,Cryptomonas ovata,Cryptomonas,ovata,NA,Soft Body,i,prolate spheroid,31.5,NA,NA,4599.829684,NA,NA,NA,NA,NA,NA,NA,NA,NA,NA,NA,NA,NA,NA,NA,NA,NA,NA,NA,NA,NA,NA,NA,NA,NA,NA,NA,NA,NA,NA,NA,NA,NA,NA,NA
1/29/2014,9:55:00,1/29/2014 9:55,STTD,STTD_2014-01-29 09:55:00,0,64,3,34833.2361,0.046875,0.069746499,314.159,1.046197485,NA,15,100.095506,Low sediment and high detritus.,348,784,Chroococcus microscopicus,Chroococcus,microscopicus,NA,Soft Body,c,sphere,0.75,NA,NA,0.22,0.22,0.22,0.22,0.22,0.22,0.22,0.22,0.22,0.22,NA,NA,NA,NA,NA,NA,NA,NA,NA,NA,NA,NA,NA,NA,NA,NA,NA,NA,NA,NA,NA,NA,NA,NA,NA,NA
1/29/2014,13:19:00,1/29/2014 13:19,LIS,LIS_2014-01-29 13:19:00,0,64,1,563.0372214,0.015625,0.069746499,314.159,0.557971992,NA,8,563.0372214,Fragment. High sediment and moderate detritus.,1,1,Aulacoseira sp.,Aulacoseira,sp.,NA,Diatom,i,cylinder,16.7,NA,NA,554.1568411,NA,NA,NA,NA,NA,NA,NA,NA,NA,NA,NA,NA,NA,NA,NA,NA,NA,NA,NA,NA,NA,NA,NA,NA,NA,NA,NA,NA,NA,NA,NA,NA,NA,NA,NA
1/29/2014,13:19:00,1/29/2014 13:19,LIS,LIS_2014-01-29 13:19:00,0,64,1,563.0372214,0.015625,0.069746499,314.159,0.557971992,NA,8,563.0372214,High sediment and moderate detritus.,1,1,cf. Cyclotella sp.,Cyclotella,sp.,NA,Diatom,i,cylinder,6.5,NA,NA,63.04778431,NA,NA,NA,NA,NA,NA,NA,NA,NA,NA,NA,NA,NA,NA,NA,NA,NA,NA,NA,NA,NA,NA,NA,NA,NA,NA,NA,NA,NA,NA,NA,NA,NA,NA,NA
1/29/2014,13:19:00,1/29/2014 13:19,LIS,LIS_2014-01-29 13:19:00,0,64,1,10134.66999,0.015625,0.069746499,314.159,0.557971992,NA,8,563.0372214,High sediment and moderate detritus.,18,18,Fragilaria capucina,Fragilaria,capucina,NA,Diatom,c,elliptic prism,29.6,NA,NA,318.2619165,NA,NA,NA,NA,NA,NA,NA,NA,NA,NA,NA,NA,NA,NA,NA,NA,NA,NA,NA,NA,NA,NA,NA,NA,NA,NA,NA,NA,NA,NA,NA,NA,NA,NA,NA
1/29/2014,13:19:00,1/29/2014 13:19,LIS,LIS_2014-01-29 13:19:00,0,64,1,563.0372214,0.015625,0.069746499,314.159,0.557971992,NA,8,563.0372214,Girdle view. High sediment and moderate detritus.,1,1,Nitzschia cf. sigma,Nitzschia,sigma,NA,Diatom,i,prism on parallelogram,103.7,NA,NA,2839.306,NA,NA,NA,NA,NA,NA,NA,NA,NA,NA,NA,NA,NA,NA,NA,NA,NA,NA,NA,NA,NA,NA,NA,NA,NA,NA,NA,NA,NA,NA,NA,NA,NA,NA,NA
1/29/2014,13:19:00,1/29/2014 13:19,LIS,LIS_2014-01-29 13:19:00,0,64,1,1689.111664,0.015625,0.069746499,314.159,0.557971992,NA,8,563.0372214,Obscured by detritus. High sediment and moderate detritus.,3,3,Nitzschia spp.,Nitzschia,spp.,NA,Diatom,i,prism on parallelogram,20.4,NA,NA,105.672,NA,NA,NA,NA,NA,NA,NA,NA,NA,NA,NA,NA,NA,NA,NA,NA,NA,NA,NA,NA,NA,NA,NA,NA,NA,NA,NA,NA,NA,NA,NA,NA,NA,NA,NA
1/29/2014,13:19:00,1/29/2014 13:19,LIS,LIS_2014-01-29 13:19:00,0,64,1,1689.111664,0.015625,0.069746499,314.159,0.557971992,NA,8,563.0372214,High sediment and moderate detritus.,3,3,Chlamydomonas sp.,Chlamydomonas,sp.,NA,Soft Body,i,sphere,5.6,NA,NA,91.95224491,NA,NA,NA,NA,NA,NA,NA,NA,NA,NA,NA,NA,NA,NA,NA,NA,NA,NA,NA,NA,NA,NA,NA,NA,NA,NA,NA,NA,NA,NA,NA,NA,NA,NA,NA
1/29/2014,13:19:00,1/29/2014 13:19,LIS,LIS_2014-01-29 13:19:00,0,64,1,2252.148886,0.015625,0.069746499,314.159,0.557971992,NA,8,563.0372214,High sediment and moderate detritus.,4,4,Monoraphidium contortum,Monoraphidium,contortum,NA,Soft Body,i,2 cones,25.9,NA,NA,48.95592057,NA,NA,NA,NA,NA,NA,NA,NA,NA,NA,NA,NA,NA,NA,NA,NA,NA,NA,NA,NA,NA,NA,NA,NA,NA,NA,NA,NA,NA,NA,NA,NA,NA,NA,NA
1/29/2014,13:19:00,1/29/2014 13:19,LIS,LIS_2014-01-29 13:19:00,0,64,1,563.0372214,0.015625,0.069746499,314.159,0.557971992,NA,8,563.0372214,High sediment and moderate detritus.,1,1,Monoraphidium minutum,Monoraphidium,minutum,NA,Soft Body,i,2 cones,5.6,NA,NA,10.58506391,NA,NA,NA,NA,NA,NA,NA,NA,NA,NA,NA,NA,NA,NA,NA,NA,NA,NA,NA,NA,NA,NA,NA,NA,NA,NA,NA,NA,NA,NA,NA,NA,NA,NA,NA
1/29/2014,13:19:00,1/29/2014 13:19,LIS,LIS_2014-01-29 13:19:00,0,64,1,563.0372214,0.015625,0.069746499,314.159,0.557971992,NA,8,563.0372214,High sediment and moderate detritus.,1,1,Plagioselmis nannoplanctica,Plagioselmis,nannoplanctica,NA,Soft Body,i,cone + half sphere,6.4,NA,NA,128.6795264,NA,NA,NA,NA,NA,NA,NA,NA,NA,NA,NA,NA,NA,NA,NA,NA,NA,NA,NA,NA,NA,NA,NA,NA,NA,NA,NA,NA,NA,NA,NA,NA,NA,NA,NA
1/29/2014,13:19:00,1/29/2014 13:19,LIS,LIS_2014-01-29 13:19:00,0,64,1,228030.0747,0.015625,0.069746499,314.159,0.557971992,NA,8,563.0372214,High sediment and moderate detritus.,405,864,Chroococcus microscopicus,Chroococcus,microscopicus,NA,Soft Body,c,sphere,0.75,NA,NA,0.22,0.22,0.22,0.22,0.22,0.22,0.22,0.22,0.22,0.22,NA,NA,NA,NA,NA,NA,NA,NA,NA,NA,NA,NA,NA,NA,NA,NA,NA,NA,NA,NA,NA,NA,NA,NA,NA,NA
1/29/2014,13:19:00,1/29/2014 13:19,LIS,LIS_2014-01-29 13:19:00,0,64,1,1126.074443,0.015625,0.069746499,314.159,0.557971992,NA,8,563.0372214,High sediment and moderate detritus.,2,37,cf. Planktolyngbya sp.,Planktolyngbya,sp.,NA,Soft Body,f,cylinder,1.9,NA,NA,0.95504336,NA,NA,NA,NA,NA,NA,NA,NA,NA,NA,NA,NA,NA,NA,NA,NA,NA,NA,NA,NA,NA,NA,NA,NA,NA,NA,NA,NA,NA,NA,NA,NA,NA,NA,NA
1/29/2014,13:19:00,1/29/2014 13:19,LIS,LIS_2014-01-29 13:19:00,0,64,1,563.0372214,0.015625,0.069746499,314.159,0.557971992,NA,8,563.0372214,High sediment and moderate detritus.,1,1,cf. Gymnodinium sp.,Gymnodinium,sp.,NA,Soft Body,i,ellipsoid,13,NA,NA,1150.345538,NA,NA,NA,NA,NA,NA,NA,NA,NA,NA,NA,NA,NA,NA,NA,NA,NA,NA,NA,NA,NA,NA,NA,NA,NA,NA,NA,NA,NA,NA,NA,NA,NA,NA,NA
2/11/2014,10:01:00,2/11/2014 10:01,SHR,SHR_2014-02-11 10:01:00,0,64,3,250.2387651,0.046875,0.069746499,314.159,1.255436982,NA,18,83.41292169,Low sediment and high detritus.,3,3,Achnanthidium minutissimum,Achnanthidium,minutissimum,NA,Diatom,i,elliptic prism,13,NA,NA,75.5552395,NA,NA,NA,NA,NA,NA,NA,NA,NA,NA,NA,NA,NA,NA,NA,NA,NA,NA,NA,NA,NA,NA,NA,NA,NA,NA,NA,NA,NA,NA,NA,NA,NA,NA,NA
2/11/2014,10:01:00,2/11/2014 10:01,SHR,SHR_2014-02-11 10:01:00,0,64,3,333.6516868,0.046875,0.069746499,314.159,1.255436982,NA,18,83.41292169,Low sediment and high detritus.,4,4,Aulacoseira cf. alpigena,Aulacoseira,alpigena,NA,Diatom,c,cylinder,7.4,NA,NA,245.5545284,NA,NA,NA,NA,NA,NA,NA,NA,NA,NA,NA,NA,NA,NA,NA,NA,NA,NA,NA,NA,NA,NA,NA,NA,NA,NA,NA,NA,NA,NA,NA,NA,NA,NA,NA
2/11/2014,10:01:00,2/11/2014 10:01,SHR,SHR_2014-02-11 10:01:00,0,64,3,417.0646085,0.046875,0.069746499,314.159,1.255436982,NA,18,83.41292169,Low sediment and high detritus.,5,5,Cyclotella sp.,Cyclotella,sp.,NA,Diatom,i,cylinder,16.7,NA,NA,1314.237053,NA,NA,NA,NA,NA,NA,NA,NA,NA,NA,NA,NA,NA,NA,NA,NA,NA,NA,NA,NA,NA,NA,NA,NA,NA,NA,NA,NA,NA,NA,NA,NA,NA,NA,NA
2/11/2014,10:01:00,2/11/2014 10:01,SHR,SHR_2014-02-11 10:01:00,0,64,3,1418.019669,0.046875,0.069746499,314.159,1.255436982,NA,18,83.41292169,Low sediment and high detritus.,17,17,Fragilaria brevistriata,Fragilaria,brevistriata,NA,Diatom,i,elliptic prism,16.7,NA,NA,271.7663845,NA,NA,NA,NA,NA,NA,NA,NA,NA,NA,NA,NA,NA,NA,NA,NA,NA,NA,NA,NA,NA,NA,NA,NA,NA,NA,NA,NA,NA,NA,NA,NA,NA,NA,NA
2/11/2014,10:01:00,2/11/2014 10:01,SHR,SHR_2014-02-11 10:01:00,0,64,3,83.41292169,0.046875,0.069746499,314.159,1.255436982,NA,18,83.41292169,Low sediment and high detritus.,1,1,Fragilaria mazamaensis,Fragilaria,mazamaensis,NA,Diatom,i,elliptic prism,22,NA,NA,158.964454,NA,NA,NA,NA,NA,NA,NA,NA,NA,NA,NA,NA,NA,NA,NA,NA,NA,NA,NA,NA,NA,NA,NA,NA,NA,NA,NA,NA,NA,NA,NA,NA,NA,NA,NA
2/11/2014,10:01:00,2/11/2014 10:01,SHR,SHR_2014-02-11 10:01:00,0,64,3,83.41292169,0.046875,0.069746499,314.159,1.255436982,NA,18,83.41292169,Low sediment and high detritus.,1,1,Gyrosigma attenuatum,Gyrosigma,attenuatum,NA,Diatom,i,prism on parallelogram,170,NA,NA,8925,NA,NA,NA,NA,NA,NA,NA,NA,NA,NA,NA,NA,NA,NA,NA,NA,NA,NA,NA,NA,NA,NA,NA,NA,NA,NA,NA,NA,NA,NA,NA,NA,NA,NA,NA
2/11/2014,10:01:00,2/11/2014 10:01,SHR,SHR_2014-02-11 10:01:00,0,64,3,83.41292169,0.046875,0.069746499,314.159,1.255436982,NA,18,83.41292169,Low sediment and high detritus.,1,1,Melosira varians,Melosira,varians,NA,Diatom,i,cylinder,28,NA,NA,9151.828661,NA,NA,NA,NA,NA,NA,NA,NA,NA,NA,NA,NA,NA,NA,NA,NA,NA,NA,NA,NA,NA,NA,NA,NA,NA,NA,NA,NA,NA,NA,NA,NA,NA,NA,NA
2/11/2014,10:01:00,2/11/2014 10:01,SHR,SHR_2014-02-11 10:01:00,0,64,3,166.8258434,0.046875,0.069746499,314.159,1.255436982,NA,18,83.41292169,Low sediment and high detritus.,2,2,Navicula gregaria,Navicula,gregaria,NA,Diatom,i,elliptic prism,28,NA,NA,325.468724,NA,NA,NA,NA,NA,NA,NA,NA,NA,NA,NA,NA,NA,NA,NA,NA,NA,NA,NA,NA,NA,NA,NA,NA,NA,NA,NA,NA,NA,NA,NA,NA,NA,NA,NA
2/11/2014,10:01:00,2/11/2014 10:01,SHR,SHR_2014-02-11 10:01:00,0,64,3,83.41292169,0.046875,0.069746499,314.159,1.255436982,NA,18,83.41292169,Low sediment and high detritus.,1,1,Navicula tripunctata,Navicula,tripunctata,NA,Diatom,i,elliptic prism,52,NA,NA,918.915075,NA,NA,NA,NA,NA,NA,NA,NA,NA,NA,NA,NA,NA,NA,NA,NA,NA,NA,NA,NA,NA,NA,NA,NA,NA,NA,NA,NA,NA,NA,NA,NA,NA,NA,NA
2/11/2014,10:01:00,2/11/2014 10:01,SHR,SHR_2014-02-11 10:01:00,0,64,3,83.41292169,0.046875,0.069746499,314.159,1.255436982,NA,18,83.41292169,Low sediment and high detritus.,1,1,Navicula cf. trivialis,Navicula,trivialis,NA,Diatom,i,elliptic prism,37,NA,NA,430.083671,NA,NA,NA,NA,NA,NA,NA,NA,NA,NA,NA,NA,NA,NA,NA,NA,NA,NA,NA,NA,NA,NA,NA,NA,NA,NA,NA,NA,NA,NA,NA,NA,NA,NA,NA
2/11/2014,10:01:00,2/11/2014 10:01,SHR,SHR_2014-02-11 10:01:00,0,64,3,83.41292169,0.046875,0.069746499,314.159,1.255436982,NA,18,83.41292169,Low sediment and high detritus.,1,1,Neidium sp.,Neidium,sp.,NA,Diatom,i,elliptic prism,46,NA,NA,1878.67082,NA,NA,NA,NA,NA,NA,NA,NA,NA,NA,NA,NA,NA,NA,NA,NA,NA,NA,NA,NA,NA,NA,NA,NA,NA,NA,NA,NA,NA,NA,NA,NA,NA,NA,NA
2/11/2014,10:01:00,2/11/2014 10:01,SHR,SHR_2014-02-11 10:01:00,0,64,3,83.41292169,0.046875,0.069746499,314.159,1.255436982,NA,18,83.41292169,Low sediment and high detritus.,1,1,Nitzschia acicularis,Nitzschia,acicularis,NA,Diatom,i,prism on parallelogram,70,NA,NA,259,NA,NA,NA,NA,NA,NA,NA,NA,NA,NA,NA,NA,NA,NA,NA,NA,NA,NA,NA,NA,NA,NA,NA,NA,NA,NA,NA,NA,NA,NA,NA,NA,NA,NA,NA
2/11/2014,10:01:00,2/11/2014 10:01,SHR,SHR_2014-02-11 10:01:00,0,64,3,83.41292169,0.046875,0.069746499,314.159,1.255436982,NA,18,83.41292169,Low sediment and high detritus.,1,1,Nitzschia incerta,Nitzschia,incerta,NA,Diatom,i,prism on parallelogram,75,NA,NA,555,NA,NA,NA,NA,NA,NA,NA,NA,NA,NA,NA,NA,NA,NA,NA,NA,NA,NA,NA,NA,NA,NA,NA,NA,NA,NA,NA,NA,NA,NA,NA,NA,NA,NA,NA
2/11/2014,10:01:00,2/11/2014 10:01,SHR,SHR_2014-02-11 10:01:00,0,64,3,583.8904518,0.046875,0.069746499,314.159,1.255436982,NA,18,83.41292169,Low sediment and high detritus.,7,7,Nitzschia spp.,Nitzschia,spp.,NA,Diatom,i,prism on parallelogram,22,NA,NA,81.4,NA,NA,NA,NA,NA,NA,NA,NA,NA,NA,NA,NA,NA,NA,NA,NA,NA,NA,NA,NA,NA,NA,NA,NA,NA,NA,NA,NA,NA,NA,NA,NA,NA,NA,NA
2/11/2014,10:01:00,2/11/2014 10:01,SHR,SHR_2014-02-11 10:01:00,0,64,3,83.41292169,0.046875,0.069746499,314.159,1.255436982,NA,18,83.41292169,Low sediment and high detritus.,1,1,Planothidium lanceolatum,Planothidium,lanceolatum,NA,Diatom,i,elliptic prism,13,NA,NA,211.5546706,NA,NA,NA,NA,NA,NA,NA,NA,NA,NA,NA,NA,NA,NA,NA,NA,NA,NA,NA,NA,NA,NA,NA,NA,NA,NA,NA,NA,NA,NA,NA,NA,NA,NA,NA
2/11/2014,10:01:00,2/11/2014 10:01,SHR,SHR_2014-02-11 10:01:00,0,64,3,250.2387651,0.046875,0.069746499,314.159,1.255436982,NA,18,83.41292169,Low sediment and high detritus.,3,3,Ulnaria ulna,Ulnaria,ulna,NA,Diatom,i,elliptic prism,426,NA,NA,27602.79514,NA,NA,NA,NA,NA,NA,NA,NA,NA,NA,NA,NA,NA,NA,NA,NA,NA,NA,NA,NA,NA,NA,NA,NA,NA,NA,NA,NA,NA,NA,NA,NA,NA,NA,NA
2/11/2014,10:01:00,2/11/2014 10:01,SHR,SHR_2014-02-11 10:01:00,0,64,3,834.1292169,0.046875,0.069746499,314.159,1.255436982,NA,18,83.41292169,Low sediment and high detritus.,10,10,Chlorella sp.,Chlorella,sp.,NA,Soft Body,i,sphere,3.7,NA,NA,26.52182638,NA,NA,NA,NA,NA,NA,NA,NA,NA,NA,NA,NA,NA,NA,NA,NA,NA,NA,NA,NA,NA,NA,NA,NA,NA,NA,NA,NA,NA,NA,NA,NA,NA,NA,NA
2/11/2014,10:01:00,2/11/2014 10:01,SHR,SHR_2014-02-11 10:01:00,0,64,3,83.41292169,0.046875,0.069746499,314.159,1.255436982,NA,18,83.41292169,Low sediment and high detritus.,1,39,Microspora sp.,Microspora,sp.,NA,Soft Body,f,prolate spheroid,5.6,NA,NA,60.75416181,NA,NA,NA,NA,NA,NA,NA,NA,NA,NA,NA,NA,NA,NA,NA,NA,NA,NA,NA,NA,NA,NA,NA,NA,NA,NA,NA,NA,NA,NA,NA,NA,NA,NA,NA
2/11/2014,10:01:00,2/11/2014 10:01,SHR,SHR_2014-02-11 10:01:00,0,64,3,30195.47765,0.046875,0.069746499,314.159,1.255436982,NA,18,83.41292169,Low sediment and high detritus.,362,742,Chroococcus microscopicus,Chroococcus,microscopicus,NA,Soft Body,c,sphere,0.75,NA,NA,0.22,0.22,0.22,0.22,0.22,0.22,0.22,0.22,0.22,0.22,NA,NA,NA,NA,NA,NA,NA,NA,NA,NA,NA,NA,NA,NA,NA,NA,NA,NA,NA,NA,NA,NA,NA,NA,NA,NA
2/24/2014,9:10:00,2/24/2014 9:10,SHR,SHR_2014-02-24 09:10:00,0,64,5,277.1875552,0.078125,0.069746499,314.159,0.906704487,NA,13,69.29688879,Low sediment and high detritus.,4,4,Achnanthidium minutissimum,Achnanthidium,minutissimum,NA,Diatom,i,elliptic prism,22,NA,NA,127.862713,NA,NA,NA,NA,NA,NA,NA,NA,NA,NA,NA,NA,NA,NA,NA,NA,NA,NA,NA,NA,NA,NA,NA,NA,NA,NA,NA,NA,NA,NA,NA,NA,NA,NA,NA
2/24/2014,9:10:00,2/24/2014 9:10,SHR,SHR_2014-02-24 09:10:00,0,64,5,277.1875552,0.078125,0.069746499,314.159,0.906704487,NA,13,69.29688879,Low sediment and high detritus.,4,4,Aulacoseira alpigena,Aulacoseira,alpigena,NA,Diatom,c,cylinder,7.5,NA,NA,184.725492,NA,NA,NA,NA,NA,NA,NA,NA,NA,NA,NA,NA,NA,NA,NA,NA,NA,NA,NA,NA,NA,NA,NA,NA,NA,NA,NA,NA,NA,NA,NA,NA,NA,NA,NA
2/24/2014,9:10:00,2/24/2014 9:10,SHR,SHR_2014-02-24 09:10:00,0,64,5,207.8906664,0.078125,0.069746499,314.159,0.906704487,NA,13,69.29688879,Low sediment and high detritus.,3,3,Cocconeis placentula,Cocconeis,placentula,NA,Diatom,i,elliptic prism,15,NA,NA,176.7144375,NA,NA,NA,NA,NA,NA,NA,NA,NA,NA,NA,NA,NA,NA,NA,NA,NA,NA,NA,NA,NA,NA,NA,NA,NA,NA,NA,NA,NA,NA,NA,NA,NA,NA,NA
2/24/2014,9:10:00,2/24/2014 9:10,SHR,SHR_2014-02-24 09:10:00,0,64,5,69.29688879,0.078125,0.069746499,314.159,0.906704487,NA,13,69.29688879,Low sediment and high detritus.,1,1,Cyclotella ocellata,Cyclotella,ocellata,NA,Diatom,i,cylinder,7.4,NA,NA,129.0251013,NA,NA,NA,NA,NA,NA,NA,NA,NA,NA,NA,NA,NA,NA,NA,NA,NA,NA,NA,NA,NA,NA,NA,NA,NA,NA,NA,NA,NA,NA,NA,NA,NA,NA,NA
2/24/2014,9:10:00,2/24/2014 9:10,SHR,SHR_2014-02-24 09:10:00,0,64,5,554.3751103,0.078125,0.069746499,314.159,0.906704487,NA,13,69.29688879,Low sediment and high detritus.,8,8,cf. Cyclotella sp.,Cyclotella,sp.,NA,Diatom,i,cylinder,16.8,NA,NA,1330.023542,NA,NA,NA,NA,NA,NA,NA,NA,NA,NA,NA,NA,NA,NA,NA,NA,NA,NA,NA,NA,NA,NA,NA,NA,NA,NA,NA,NA,NA,NA,NA,NA,NA,NA,NA
2/24/2014,9:10:00,2/24/2014 9:10,SHR,SHR_2014-02-24 09:10:00,0,64,5,69.29688879,0.078125,0.069746499,314.159,0.906704487,NA,13,69.29688879,Low sediment and high detritus.,1,1,Cyclotella sp.,Cyclotella,sp.,NA,Diatom,i,cylinder,15,NA,NA,1060.286625,NA,NA,NA,NA,NA,NA,NA,NA,NA,NA,NA,NA,NA,NA,NA,NA,NA,NA,NA,NA,NA,NA,NA,NA,NA,NA,NA,NA,NA,NA,NA,NA,NA,NA,NA
2/24/2014,9:10:00,2/24/2014 9:10,SHR,SHR_2014-02-24 09:10:00,0,64,5,69.29688879,0.078125,0.069746499,314.159,0.906704487,NA,13,69.29688879,Low sediment and high detritus.,1,1,Encyonema silesiacum,Encyonema,silesiacum,NA,Diatom,i,cymbelloid,26,NA,NA,483.6589915,NA,NA,NA,NA,NA,NA,NA,NA,NA,NA,NA,NA,NA,NA,NA,NA,NA,NA,NA,NA,NA,NA,NA,NA,NA,NA,NA,NA,NA,NA,NA,NA,NA,NA,NA
2/24/2014,9:10:00,2/24/2014 9:10,SHR,SHR_2014-02-24 09:10:00,0,64,5,138.5937776,0.078125,0.069746499,314.159,0.906704487,NA,13,69.29688879,Low sediment and high detritus.,2,2,Fragilaria brevistriata,Fragilaria,brevistriata,NA,Diatom,i,elliptic prism,16.7,NA,NA,145.5891346,NA,NA,NA,NA,NA,NA,NA,NA,NA,NA,NA,NA,NA,NA,NA,NA,NA,NA,NA,NA,NA,NA,NA,NA,NA,NA,NA,NA,NA,NA,NA,NA,NA,NA,NA
2/24/2014,9:10:00,2/24/2014 9:10,SHR,SHR_2014-02-24 09:10:00,0,64,5,69.29688879,0.078125,0.069746499,314.159,0.906704487,NA,13,69.29688879,Low sediment and high detritus.,1,1,Geissleria decussis,Geissleria,decussis,NA,Diatom,i,elliptic prism,26,NA,NA,302.220958,NA,NA,NA,NA,NA,NA,NA,NA,NA,NA,NA,NA,NA,NA,NA,NA,NA,NA,NA,NA,NA,NA,NA,NA,NA,NA,NA,NA,NA,NA,NA,NA,NA,NA,NA
2/24/2014,9:10:00,2/24/2014 9:10,SHR,SHR_2014-02-24 09:10:00,0,64,5,138.5937776,0.078125,0.069746499,314.159,0.906704487,NA,13,69.29688879,Low sediment and high detritus.,2,2,Melosira varians,Melosira,varians,NA,Diatom,i,cylinder,22,NA,NA,7619.926545,NA,NA,NA,NA,NA,NA,NA,NA,NA,NA,NA,NA,NA,NA,NA,NA,NA,NA,NA,NA,NA,NA,NA,NA,NA,NA,NA,NA,NA,NA,NA,NA,NA,NA,NA
2/24/2014,9:10:00,2/24/2014 9:10,SHR,SHR_2014-02-24 09:10:00,0,64,5,69.29688879,0.078125,0.069746499,314.159,0.906704487,NA,13,69.29688879,Low sediment and high detritus.,1,1,Navicula sp.,Navicula,sp.,NA,Diatom,i,elliptic prism,41,NA,NA,2144.606414,NA,NA,NA,NA,NA,NA,NA,NA,NA,NA,NA,NA,NA,NA,NA,NA,NA,NA,NA,NA,NA,NA,NA,NA,NA,NA,NA,NA,NA,NA,NA,NA,NA,NA,NA
2/24/2014,9:10:00,2/24/2014 9:10,SHR,SHR_2014-02-24 09:10:00,0,64,5,69.29688879,0.078125,0.069746499,314.159,0.906704487,NA,13,69.29688879,Low sediment and high detritus.,1,1,Nitzschia inconspicua,Nitzschia,inconspicua,NA,Diatom,i,prism on parallelogram,11,NA,NA,33,NA,NA,NA,NA,NA,NA,NA,NA,NA,NA,NA,NA,NA,NA,NA,NA,NA,NA,NA,NA,NA,NA,NA,NA,NA,NA,NA,NA,NA,NA,NA,NA,NA,NA,NA
2/24/2014,9:10:00,2/24/2014 9:10,SHR,SHR_2014-02-24 09:10:00,0,64,5,138.5937776,0.078125,0.069746499,314.159,0.906704487,NA,13,69.29688879,Low sediment and high detritus.,2,2,Nitzschia spp.,Nitzschia,spp.,NA,Diatom,i,prism on parallelogram,22,NA,NA,176,NA,NA,NA,NA,NA,NA,NA,NA,NA,NA,NA,NA,NA,NA,NA,NA,NA,NA,NA,NA,NA,NA,NA,NA,NA,NA,NA,NA,NA,NA,NA,NA,NA,NA,NA
2/24/2014,9:10:00,2/24/2014 9:10,SHR,SHR_2014-02-24 09:10:00,0,64,5,3672.735106,0.078125,0.069746499,314.159,0.906704487,NA,13,69.29688879,Low sediment and high detritus.,53,53,Chlorella sp.,Chlorella,sp.,NA,Soft Body,i,sphere,3.7,NA,NA,26.52182638,NA,NA,NA,NA,NA,NA,NA,NA,NA,NA,NA,NA,NA,NA,NA,NA,NA,NA,NA,NA,NA,NA,NA,NA,NA,NA,NA,NA,NA,NA,NA,NA,NA,NA,NA
2/24/2014,9:10:00,2/24/2014 9:10,SHR,SHR_2014-02-24 09:10:00,0,64,5,207.8906664,0.078125,0.069746499,314.159,0.906704487,NA,13,69.29688879,Low sediment and high detritus.,3,3,Monoraphidium arcuatum,Monoraphidium,arcuatum,NA,Soft Body,i,2 cones,22,NA,NA,46.07665333,NA,NA,NA,NA,NA,NA,NA,NA,NA,NA,NA,NA,NA,NA,NA,NA,NA,NA,NA,NA,NA,NA,NA,NA,NA,NA,NA,NA,NA,NA,NA,NA,NA,NA,NA
2/24/2014,9:10:00,2/24/2014 9:10,SHR,SHR_2014-02-24 09:10:00,0,64,5,69.29688879,0.078125,0.069746499,314.159,0.906704487,NA,13,69.29688879,Low sediment and high detritus.,1,4,Scenedesmus sp.,Scenedesmus,sp.,NA,Soft Body,c,prolate spheroid,7.4,NA,NA,53.04365276,NA,NA,NA,NA,NA,NA,NA,NA,NA,NA,NA,NA,NA,NA,NA,NA,NA,NA,NA,NA,NA,NA,NA,NA,NA,NA,NA,NA,NA,NA,NA,NA,NA,NA,NA
2/24/2014,9:10:00,2/24/2014 9:10,SHR,SHR_2014-02-24 09:10:00,0,64,5,69.29688879,0.078125,0.069746499,314.159,0.906704487,NA,13,69.29688879,Low sediment and high detritus.,1,4,Tetrastrum glabrum,Tetrastrum,glabrum,NA,Soft Body,c,sphere,4.7,NA,NA,54.36154976,NA,NA,NA,NA,NA,NA,NA,NA,NA,NA,NA,NA,NA,NA,NA,NA,NA,NA,NA,NA,NA,NA,NA,NA,NA,NA,NA,NA,NA,NA,NA,NA,NA,NA,NA
2/24/2014,9:10:00,2/24/2014 9:10,SHR,SHR_2014-02-24 09:10:00,0,64,5,277.1875552,0.078125,0.069746499,314.159,0.906704487,NA,13,69.29688879,Low sediment and high detritus.,4,4,Plagioselmis nannoplanctica,Plagioselmis,nannoplanctica,NA,Soft Body,i,N/A,6,NA,NA,109.327332,NA,NA,NA,NA,NA,NA,NA,NA,NA,NA,NA,NA,NA,NA,NA,NA,NA,NA,NA,NA,NA,NA,NA,NA,NA,NA,NA,NA,NA,NA,NA,NA,NA,NA,NA
2/24/2014,9:10:00,2/24/2014 9:10,SHR,SHR_2014-02-24 09:10:00,0,64,5,22452.19197,0.078125,0.069746499,314.159,0.906704487,NA,13,69.29688879,Low sediment and high detritus.,324,665,Chroococcus microscopicus,Chroococcus,microscopicus,NA,Soft Body,c,sphere,0.75,NA,NA,0.22,0.22,0.22,0.22,0.22,0.22,0.22,0.22,0.22,0.22,NA,NA,NA,NA,NA,NA,NA,NA,NA,NA,NA,NA,NA,NA,NA,NA,NA,NA,NA,NA,NA,NA,NA,NA,NA,NA
2/24/2014,9:10:00,2/24/2014 9:10,SHR,SHR_2014-02-24 09:10:00,0,64,5,69.29688879,0.078125,0.069746499,314.159,0.906704487,NA,13,69.29688879,Low sediment and high detritus.,1,1,Euglena sp.,Euglena,sp.,NA,Soft Body,i,half ellipsoid + cone on an elliptic base,26,NA,NA,735.13206,NA,NA,NA,NA,NA,NA,NA,NA,NA,NA,NA,NA,NA,NA,NA,NA,NA,NA,NA,NA,NA,NA,NA,NA,NA,NA,NA,NA,NA,NA,NA,NA,NA,NA,NA
2/24/2014,9:10:00,2/24/2014 9:10,SHR,SHR_2014-02-24 09:10:00,0,64,5,69.29688879,0.078125,0.069746499,314.159,0.906704487,NA,13,69.29688879,Low sediment and high detritus.,1,1,cf. Lepocinclis sp.,Lepocinclis,sp.,NA,Soft Body,i,2 cones,37,NA,NA,1089.739031,NA,NA,NA,NA,NA,NA,NA,NA,NA,NA,NA,NA,NA,NA,NA,NA,NA,NA,NA,NA,NA,NA,NA,NA,NA,NA,NA,NA,NA,NA,NA,NA,NA,NA,NA
2/24/2014,12:30:00,2/24/2014 12:30,STTD,STTD_2014-02-24 12:30:00,0,65,3,166.8258434,0.046153846,0.069746499,314.159,0.627718491,NA,9,166.8258434,Low sediment and moderate detritus.,1,1,cf. Cyclotella sp.,Cyclotella,sp.,NA,Diatom,i,cylinder,7.4,NA,NA,159.1309583,NA,NA,NA,NA,NA,NA,NA,NA,NA,NA,NA,NA,NA,NA,NA,NA,NA,NA,NA,NA,NA,NA,NA,NA,NA,NA,NA,NA,NA,NA,NA,NA,NA,NA,NA
2/24/2014,12:30:00,2/24/2014 12:30,STTD,STTD_2014-02-24 12:30:00,0,65,3,166.8258434,0.046153846,0.069746499,314.159,0.627718491,NA,9,166.8258434,Low sediment and moderate detritus.,1,1,Nitzschia palea,Nitzschia,palea,NA,Diatom,i,prism on parallelogram,33.3,NA,NA,344.988,NA,NA,NA,NA,NA,NA,NA,NA,NA,NA,NA,NA,NA,NA,NA,NA,NA,NA,NA,NA,NA,NA,NA,NA,NA,NA,NA,NA,NA,NA,NA,NA,NA,NA,NA
2/24/2014,12:30:00,2/24/2014 12:30,STTD,STTD_2014-02-24 12:30:00,0,65,3,166.8258434,0.046153846,0.069746499,314.159,0.627718491,NA,9,166.8258434,Obscured by detritus. Low sediment and moderate detritus.,1,1,Nitzschia sp.,Nitzschia,sp.,NA,Diatom,i,prism on parallelogram,22.2,NA,NA,151.959,NA,NA,NA,NA,NA,NA,NA,NA,NA,NA,NA,NA,NA,NA,NA,NA,NA,NA,NA,NA,NA,NA,NA,NA,NA,NA,NA,NA,NA,NA,NA,NA,NA,NA,NA
2/24/2014,12:30:00,2/24/2014 12:30,STTD,STTD_2014-02-24 12:30:00,0,65,3,333.6516868,0.046153846,0.069746499,314.159,0.627718491,NA,9,166.8258434,Low sediment and moderate detritus.,2,2,Chlorella spp.,Chlorella,spp.,NA,Soft Body,i,sphere,5.6,NA,NA,91.95224491,NA,NA,NA,NA,NA,NA,NA,NA,NA,NA,NA,NA,NA,NA,NA,NA,NA,NA,NA,NA,NA,NA,NA,NA,NA,NA,NA,NA,NA,NA,NA,NA,NA,NA,NA
2/24/2014,12:30:00,2/24/2014 12:30,STTD,STTD_2014-02-24 12:30:00,0,65,3,834.1292169,0.046153846,0.069746499,314.159,0.627718491,NA,9,166.8258434,Low sediment and moderate detritus.,5,5,Monoraphidium contortum,Monoraphidium,contortum,NA,Soft Body,i,2 cones,16.7,NA,NA,31.56617272,NA,NA,NA,NA,NA,NA,NA,NA,NA,NA,NA,NA,NA,NA,NA,NA,NA,NA,NA,NA,NA,NA,NA,NA,NA,NA,NA,NA,NA,NA,NA,NA,NA,NA,NA
2/24/2014,12:30:00,2/24/2014 12:30,STTD,STTD_2014-02-24 12:30:00,0,65,3,333.6516868,0.046153846,0.069746499,314.159,0.627718491,NA,9,166.8258434,Low sediment and moderate detritus.,2,2,Monoraphidium convolutum,Monoraphidium,convolutum,NA,Soft Body,i,2 cones,5.6,NA,NA,10.58506391,NA,NA,NA,NA,NA,NA,NA,NA,NA,NA,NA,NA,NA,NA,NA,NA,NA,NA,NA,NA,NA,NA,NA,NA,NA,NA,NA,NA,NA,NA,NA,NA,NA,NA,NA
2/24/2014,12:30:00,2/24/2014 12:30,STTD,STTD_2014-02-24 12:30:00,0,65,3,667.3033735,0.046153846,0.069746499,314.159,0.627718491,NA,9,166.8258434,Low sediment and moderate detritus.,4,4,Chrysococcus sp.,Chrysococcus,sp.,NA,Soft Body,i,prolate spheroid,7.4,NA,NA,212.174611,NA,NA,NA,NA,NA,NA,NA,NA,NA,NA,NA,NA,NA,NA,NA,NA,NA,NA,NA,NA,NA,NA,NA,NA,NA,NA,NA,NA,NA,NA,NA,NA,NA,NA,NA
2/24/2014,12:30:00,2/24/2014 12:30,STTD,STTD_2014-02-24 12:30:00,0,65,3,166.8258434,0.046153846,0.069746499,314.159,0.627718491,NA,9,166.8258434,Low sediment and moderate detritus.,1,1,Plagioselmis lacustris,Plagioselmis,lacustris,NA,Soft Body,i,cone + half sphere,8,NA,NA,242.9496267,NA,NA,NA,NA,NA,NA,NA,NA,NA,NA,NA,NA,NA,NA,NA,NA,NA,NA,NA,NA,NA,NA,NA,NA,NA,NA,NA,NA,NA,NA,NA,NA,NA,NA,NA
2/24/2014,12:30:00,2/24/2014 12:30,STTD,STTD_2014-02-24 12:30:00,0,65,3,333.6516868,0.046153846,0.069746499,314.159,0.627718491,NA,9,166.8258434,Low sediment and moderate detritus.,2,2,Plagioselmis nannoplanctica,Plagioselmis,nannoplanctica,NA,Soft Body,i,cone + half sphere,6,NA,NA,91.420269,NA,NA,NA,NA,NA,NA,NA,NA,NA,NA,NA,NA,NA,NA,NA,NA,NA,NA,NA,NA,NA,NA,NA,NA,NA,NA,NA,NA,NA,NA,NA,NA,NA,NA,NA
